id,__v,_id,name,type,onMap,overX,overZ,owner,isBank,radius,isCourt,netherX,netherZ,dateFrom,isOffice,createdAt,updatedAt,colorNether,description,isProhibition
1314,0,6647bbde25da733432a32866,Огород,База,false,-24154,-3274,kapystik,false,1000,false,-3019,-408,17.05.2024,false,2024-05-17T20:19:42.984Z,2024-05-17T20:23:31.951Z,blue,<p>Просто личная база игрока kapystik</p>,false
1313,0,66438f9d25da733432a317bf,Аванпост - Ноль,База,false,-30706,-9608,Mr_Zabeiaka,false,2000,false,-3839,-1202,14.05.2024,false,2024-05-14T16:21:49.669Z,2024-05-14T16:21:49.669Z,blue,"<p>Место промышленной добычи ресурсов, находящиеся под контролем Колонии ""B.C.243.a</p>",false
1312,0,66423c8025da733432a30e9b,Дача,База,false,12407,-26037,fliri_lime,false,1000,false,1550,-3254,13.05.2024,false,2024-05-13T16:14:56.763Z,2024-05-13T16:14:56.763Z,red,<p>дача флири лайма</p>,false
1311,0,6642159a25da733432a30c35,База Грибвиля,База,false,11500,5300,1ev_,false,500,false,1440,660,13.05.2024,false,2024-05-13T13:28:58.904Z,2024-05-13T13:28:58.904Z,green,<p>Личная база игрока 1ev_</p>,false
1310,0,6642116625da733432a30beb,Эквестрия,Город,false,-9700,9700,sh1zukA11,false,2000,false,-1200,1200,13.05.2024,false,2024-05-13T13:11:02.658Z,2024-05-13T13:11:02.658Z,yellow,<p>Полнолстью перестроенная карта Эквестрии из мульт-сериала MLP.</p>,false
1309,0,66410fbb25da733432a30672,_VolTar_,База,false,-28812,-6284,_VolTar_,false,500,false,-3617,-773,12.05.2024,false,2024-05-12T18:51:39.466Z,2024-05-12T18:51:39.466Z,blue,<p>-</p>,false
1308,0,6640f1de25da733432a30474,Новоперделкино,База,false,2550,16970,bogdannewbalance,false,500,false,318,-2122,12.05.2024 ,false,2024-05-12T16:44:14.995Z,2024-05-12T16:44:14.995Z,red,<p>-</p>,false
1307,0,6640a7e325da733432a301a4,База L0L0R,База,false,-22700,-33611,L0L0R,false,1000,false,-2835,-4200,12.05.2024,false,2024-05-12T11:28:35.040Z,2024-05-12T11:28:35.040Z,red,<p>База</p>,false
1306,0,663f99f225da733432a2f9a7,BusyCity,Город,false,20000,14000,Heleg,false,1000,false,2431,1750,09.05.2024,false,2024-05-11T16:16:50.179Z,2024-05-11T16:16:50.179Z,green,"<p>Город, наполненный бизнес-центрами, офисами, заводами и так далее.</p>",false
1305,0,663f5f0d25da733432a2f64a,ТипоЯма,База,false,4280,240,Super_Klepa,false,1000,false,525,86,11.05.2024,false,2024-05-11T12:05:33.591Z,2024-05-11T12:05:33.591Z,green,<p>Жеские забиверы с 2b2t</p>,false
1304,0,663e4e7325da733432a2ec24,Хайп База,База,false,-24683,-3792,mrkorzhik,false,1000,false,-3086,-470,10.05.2024,false,2024-05-10T16:42:27.579Z,2024-05-10T16:42:27.579Z,blue,"<p>Огромнй элитный дом, много автоферм, есть ферма со спавнерами, большая территория для простора мыслей</p>",false
1303,0,663cdf8725da733432a2e4fe,Базамбосс Slaut1x,База,false,-34262,4206,Slautix,false,1500,false,-4285,547,08.05.2024,false,2024-05-09T14:36:55.189Z,2024-05-09T14:36:55.189Z,blue,<p>Место жительства соло тюбика</p>,false
1301,0,663cb0c425da733432a2e363,Лаборатория Jabi,База,false,-19880,-3815,Jabochca_Soviet,false,2000,false,-2500,-12,09.05.2024,false,2024-05-09T11:17:24.996Z,2024-05-09T11:17:24.996Z,blue,"<p>Лучшая яма, которую когда либо</p><p>видел белый свет. </p><p>Аве Верден!</p><p></p>",true
1300,0,663bb0f725da733432a2d814,Пупупу,База,false,-5347,-11224,EterN1aLMoyKotik,false,1000,false,-668,-1402,08.05.2024,false,2024-05-08T17:05:59.273Z,2024-05-08T17:25:07.673Z,red,<p>Вау чё реал внатуре</p>,false
1299,0,663b5df425da733432a2d07b,"Каменоломня ""TF2""",База,false,3400,-7500,mrKAMEH,false,300,false,425,-937,08.05.2024,false,2024-05-08T11:11:48.047Z,2024-05-08T11:11:48.047Z,red,<p>Копай камень</p><p> Сдавай камень</p><p> Получай ары или</p><p> другие штуки</p>,false
1298,0,663a694c25da733432a2ce7b,Актиний,Город,false,18254,-3615,Loma2000,false,1000,false,2282,452,14.10.23,false,2024-05-07T17:47:56.779Z,2024-05-07T17:47:56.779Z,green,<p>-</p>,false
1297,0,663a668925da733432a2ce6b,Дертонскай,Город,false,-189,-9565,_StarkOff_,false,200,false,-14,-1198,07.05.2024,false,2024-05-07T17:36:09.799Z,2024-05-07T17:36:09.799Z,red,<p>Миленький городок с добреньким коллективом и красивой архитектурой</p>,false
1296,0,6639272425da733432a2c546,База Тори,База,false,16441,1641,Lookkiller,false,2000,false,2061,165,06.05.2024,false,2024-05-06T18:53:24.658Z,2024-05-06T18:53:24.658Z,green,"<p>Да здравствует особняки мени Тори, довольно большой и дорогой. 52 нашим</p>",false
1295,0,6639256325da733432a2c537,Вильсант,База,false,11200,21600,Skorvod,false,2000,false,1400,2698,06.05.2024,false,2024-05-06T18:45:55.791Z,2024-05-06T18:45:55.791Z,yellow,<p>Моя база. Большая часть находится в незере. ПРИЗНАЮ ТЕРРИТОРИЮ АДА В РАДИУСЕ 250 БЛОКОВ (2000 : 8) МОЕЙ. И ХАЙПЕРЛУПА ТОЖ МОЯ.</p>,false
1294,0,663923cc25da733432a2c516,ZомбиOптимусVлад,База,false,11908,4391,Vakinjopas,false,500,false,1488,549,06.05.2024,false,2024-05-06T18:39:08.179Z,2024-05-06T18:39:08.179Z,green,<p>чекай название</p>,false
1293,0,6639229025da733432a2c507,Тайтон,База,false,1000,28500,_Koja,false,998,false,125,3560,06.05.2024,false,2024-05-06T18:33:52.499Z,2024-05-06T18:33:52.499Z,yellow,"<p>Город в стиле ""Звёздные войны"" Планета на которой появились первые джедаи и так же здесь основали ""Орден джедаев""</p>",false
1292,0,6638e5b025da733432a2c332,CRISTALIX CITY,Город,false,-3957,3112,Cristalix_gg,false,200,false,-493,392,06.05.2024,false,2024-05-06T14:14:08.335Z,2024-05-06T14:14:08.335Z,blue,<p>САМыЙ пиздатый city ever</p>,false
1291,0,6637b96c25da733432a2b859,Кур-де-Фонтейн ЮЗ+,База,false,-20000,26000,DizWasTaken,false,2000,false,-2500,3250,05.05.2024,false,2024-05-05T16:53:00.464Z,2024-05-05T16:53:00.464Z,yellow,"<p>Один из семи регионов Тейвата. Это королевство, поклоняющееся Фокалорс, Гидро Архонту и богине Справедливости</p>",false
1290,0,66351d1b25da733432a29303,Backrooms,База,false,33673,1618,ArtBo,false,200,false,4219,209,03.05.2024,false,2024-05-03T17:21:31.578Z,2024-05-03T17:21:31.578Z,green,"<p>бесконечные коридоры, много </p><p>уровней... база в стиле закулисья</p>",false
1289,0,663417d9882b87aaea0a89b1,Правило трех сигм,Город,false,14400,11120,Ustaz1505,false,650,false,1825,1390,03.05.2024,false,2024-05-02T22:46:49.892Z,2024-05-02T22:46:49.892Z,green,<p>База трех прикольных игроков</p>,false
1288,0,662f9063882b87aaea0a6f18,LanlokBase,База,false,-4316,-465,Lanlok,false,100,false,-540,-56,29.04.2024,false,2024-04-29T12:19:47.445Z,2024-05-05T06:52:01.110Z,blue,<p>База Lanlok'a. Хотя скорее склад</p>,false
1287,0,662e5fec882b87aaea0a6a89,Кур-де-Фонтейн ЮВ,База,false,-14000,24000,DizWasTaken,false,2000,false,-1750,3000,28.04.2024,false,2024-04-28T14:40:44.258Z,2024-04-28T14:41:35.318Z,yellow,"<p>Один из семи регионов Тейвата. Это королевство, поклоняющееся Фокалорс, Гидро Архонту и богине Справедливости</p>",false
1286,0,662e5f44882b87aaea0a6a52,Кур-де-Фонтейн ЮЗ,База,false,-18000,24000,DizWasTaken,false,2000,false,-2250,3000,28.04.2024,false,2024-04-28T14:37:56.824Z,2024-04-28T14:37:56.824Z,yellow,"<p> Один из семи регионов Тейвата. Это королевство, поклоняющееся Фокалорс, Гидро Архонту и богине Справедливости</p>",false
1285,0,662e5ed0882b87aaea0a6a34,Кур-де-Фонтейн СВ,База,false,-14000,20000,DizWasTaken,false,2000,false,-1750,2500,28.04.2024,false,2024-04-28T14:36:00.940Z,2024-04-28T14:36:00.940Z,yellow,"<p>Один из семи регионов Тейвата. Это королевство, поклоняющееся Фокалорс, Гидро Архонту и богине Справедливости</p>",false
1284,0,662e5de1882b87aaea0a69d4,Кур-де-Фонтейн СЗ,База,false,-18000,20000,DizWasTaken,false,2000,false,-2250,2500,28.04.2024,false,2024-04-28T14:32:01.835Z,2024-04-28T14:32:01.835Z,yellow,"<p>Один из семи регионов Тейвата. Это королевство, поклоняющееся Фокалорс, Гидро Архонту и богине Справедливости</p>",false
1283,0,662e36f5813cda8eede06fba,Башня Магов,База,false,494,-1141,LKGF,false,100,false,3,-94,28.04.2024,false,2024-04-28T11:45:57.442Z,2024-04-28T11:45:57.442Z,red,<p>База LKGF и <em>FluruS</em></p><p>выполненная в стиле</p><p>2-ух магических башен</p>,false
1282,0,662e293f813cda8eede06efc,ЗВ 3000,База,false,23513,-4927,semeone,false,500,false,2905,-635,28.04.2024,false,2024-04-28T10:47:27.947Z,2024-04-28T10:47:27.947Z,green,<p>запретка</p>,false
1281,0,662a9cb8813cda8eede0608b,TNS,База,false,-4862,21657,BetaTrail,false,1000,false,-616,2700,25.04.2024,false,2024-04-25T18:11:04.684Z,2024-04-25T18:11:04.684Z,yellow,<p>каво? деда</p>,false
1280,0,662a7fad813cda8eede05eb0,МЭШленд,Город,false,-284,-9212,Bomberiks,false,67,false,-22,-1148,25.04.2024,false,2024-04-25T16:07:09.723Z,2024-04-25T16:07:09.723Z,red,"<p>Обычный маленький пещерный городок для крыс,мышей. Обычно туда заселяются исключительно мыши/крыси, другим запрет.</p>",false
1279,0,662a3ba832a0e46ecfa9630f,Dopamine Hotel,Город,false,-26009,81,Bulat_SP,false,100,false,-3245,16,25.04.2024,false,2024-04-25T11:16:56.594Z,2024-04-25T11:16:56.594Z,blue,"<p>Отель Dopamine, позволит вам иметь жильё, по очень демократичным ценам иметь место, где вы можете остаться на сколько вы Пожелаете!</p>",false
1278,0,6628001332a0e46ecfa95971,Багровая база,База,false,-8149,-1098,Hi_Haiden,false,38,false,-1019,-137,23.04.2024,false,2024-04-23T18:38:11.938Z,2024-04-23T18:38:11.938Z,blue,<p>База общежитие для нуждающихся</p>,false
1276,0,6625024a22168739df8df242,SnowLand,Город,false,4397,-30465,Ckrasti_,false,1100,false,549,-3808,21.04.2024,false,2024-04-21T12:10:50.900Z,2024-04-21T12:10:50.900Z,red,<p>Снежный город</p>,false
1275,0,6624d9fe22168739df8def09,Домик,База,false,22500,-24500,Evka0vevkov1ch,false,2000,false,2812,-3062,21.04.2024,false,2024-04-21T09:18:54.383Z,2024-04-21T09:18:54.383Z,red,<p>Тихий уголок про который никто не узнает...</p>,false
1274,0,6624d76422168739df8dee85,Складовская,База,false,17522,1449,Jake81i,false,250,false,2190,181,21.04.2024,false,2024-04-21T09:07:48.409Z,2024-04-21T09:09:41.510Z,green,<p>База</p>,false
1273,0,6620053f22168739df8ddb83,Типо тера,База,false,5297,-10683,Super_Klepa,false,600,false,649,-1327,17.04.2024,false,2024-04-17T17:22:07.044Z,2024-04-17T17:22:07.044Z,red,<p>Яма</p>,false
1272,0,661ec9327389a669e4fd8bfe,Wirevor Град,Город,false,-13559,7953,Wirevor,false,1000,false,-1698,995,16.04.2024,false,2024-04-16T18:53:38.552Z,2024-04-16T18:53:38.552Z,blue,<p>Город</p>,false
1271,0,661eaafd7389a669e4fd8aaf,База Капустика,База,false,-33490,3732,kapystik,false,500,false,-4186,0,16.04.2024,false,2024-04-16T16:44:45.203Z,2024-04-16T16:44:45.203Z,blue,<p>Огород</p>,false
1270,0,661d30697389a669e4fd7e02,Территория BellaDNCat,База,false,4000,8400,BellaDNCat,false,500,false,499,1050,15.04.2024,false,2024-04-15T13:49:29.120Z,2024-04-15T13:49:29.120Z,yellow,<p>Территория Жеских друзей</p>,false
1269,0,661ade4d7389a669e4fd5bc8,Свэээгград,Город,false,-13960,-16950,MrKulebyak,false,1400,false,-1745,-2118,13.04.2024,false,2024-04-13T19:34:37.238Z,2024-04-13T19:34:37.238Z,red,<p>Свэээээээээг</p>,false
1268,0,661adc627389a669e4fd5b9f,Кур-де-Фонтейн,Город,false,-16000,22000,DizWasTaken,false,2000,false,-2000,2750,14.04.2024,false,2024-04-13T19:26:26.717Z,2024-04-13T19:26:26.717Z,yellow,"<p>Один из семи регионов Тейвата. Это королевство, поклоняющееся Фокалорс, Гидро Архонту и богине Справедливости </p>",false
1267,0,661ad8c27389a669e4fd5b76,Гиперборея,Город,false,4438,20386,Animun4ik,false,1500,false,544,2553,14.04.2024,false,2024-04-13T19:10:58.651Z,2024-04-13T19:10:58.651Z,yellow,"<p>Великий</p><p>город Вед и ариев.</p><p>Блинолопатные праздники, славление</p><p>бога Пердуна и защита родины от</p><p>Ящеров!!!</p>",false
1266,0,66185a21bb54e31d25d99e75,777,Город,false,2240,-6300,Mozzit,false,200,false,280,-787,12.04.2024,false,2024-04-11T21:46:09.561Z,2024-05-06T16:20:42.100Z,red,<p>-</p>,false
1265,0,66181ef0bb54e31d25d99afe,Ыаыаэв,База,false,-6327,-32261,Budashka,false,1000,false,-781,-4029,11.04.2024,false,2024-04-11T17:33:36.573Z,2024-04-11T17:33:36.573Z,red,<p>Тут есть место в океане где всего на 1 блок равнина</p>,true
1264,0,6616ca0dbb54e31d25d992d9,СШ (Союз Школьников),Город,false,-23195,-435,ssssssalam,false,800,false,-2900,-53,10.04.24,false,2024-04-10T17:19:09.621Z,2024-04-16T16:40:33.288Z,blue,"<p>это типо город,там кайфово,особенно спавн в виде члена</p>",false
1263,0,6616c2c7bb54e31d25d99284,Территория bloggigo1,База,false,459,26313,bloggigo1,false,200,false,57,3289,10.04.2024,false,2024-04-10T16:48:07.232Z,2024-04-10T16:48:07.232Z,yellow,"<p>территория с базой и постройками, фермами bloggigo1</p>",true
1262,0,6616be8bbb54e31d25d99256,Стрельцовка,Город,false,680,-30165,rJlucT,false,200,false,85,-3770,10.04.2024,false,2024-04-10T16:30:03.231Z,2024-04-10T16:30:03.231Z,red,<p>село на севере страны с довольно тёплым климатом</p>,false
1261,0,661555dfbb54e31d25d985c4,TikTokHouse,База,false,482,5623,mmmmmik,false,200,false,50,699,09.04.2024,false,2024-04-09T14:51:11.633Z,2024-04-09T14:51:11.633Z,yellow,<p>Запретка</p>,false
1260,0,6612db01bb54e31d25d97400,тера M0delLa,База,false,-3544,-1936,M0delLa,false,300,false,-443,-242,07.04.2024,false,2024-04-07T17:42:25.868Z,2024-04-07T17:42:25.868Z,blue,<p>топ кру</p>,false
1259,0,6612a908bb54e31d25d971a5,Пирожный Рай,База,false,29900,36250,Biakye,false,2000,false,3737,4531,7.04.24,false,2024-04-07T14:09:12.349Z,2024-04-07T14:09:12.349Z,yellow,<p>База Бьякуя</p>,false
1258,0,66121d6fbb54e31d25d96c35,Гондэм,Город,false,953,6215,Mozzit bobrin0,false,500,false,117,777,07.04.2024,false,2024-04-07T04:13:35.101Z,2024-05-05T14:04:22.171Z,yellow,<p>Територия Города </p>,false
1257,0,66121394bb54e31d25d96bc9,Мышкинская терра.,База,false,-30404,-19384,zxCy4eHok,false,2000,false,-3800,-2371,07.04.2024,false,2024-04-07T03:31:32.404Z,2024-04-07T03:31:32.404Z,blue,<p>Территория для личных нужд города Мышкин.</p>,true
1256,0,6611eb75bb54e31d25d96b36,Нови Город,Город,false,15620,-8024,Chisserine,false,950,false,1952,-1005,07.04.2024,false,2024-04-07T00:40:21.495Z,2024-04-16T20:12:25.473Z,green,<p>Нови Город</p>,false
1255,0,6611ea2cbb54e31d25d96b27,Нови База,База,false,-2830,-13238,maxi_capybara,false,850,false,-353,-1703,07.04.2024,false,2024-04-07T00:34:52.288Z,2024-04-07T00:34:52.288Z,red,<p>Нови База</p>,false
1254,0,6611e7bcbb54e31d25d96abd,MasterShulion Base,База,false,7280,34824,MasterShulion,false,500,false,910,-4353,07.04.2024,false,2024-04-07T00:24:28.256Z,2024-04-07T00:24:28.256Z,red,<p>Моя жесткая База на которой фермы и мой портал на мою жестк </p><p></p>,false
1253,0,6611c859bb54e31d25d969da,Based Base,База,false,-3000,-36500,FriendlyCreeperr,false,1500,false,1500,8686,07.04.2024,false,2024-04-06T22:10:33.293Z,2024-04-07T11:26:27.171Z,yellow,<p>Ultra pro gigachad sigma база игрока FriendlyCreeperr</p><p></p>,true
1252,0,66118974bb54e31d25d96504,HCDAP ,Город,false,-17100,6099,HCDAP_Iz_HCDAPA1,false,2000,false,-2137,762,06.04.2024,false,2024-04-06T17:42:13.005Z,2024-04-06T17:42:13.005Z,blue,<p>HCDAP </p><p></p>,false
1251,0,661150acbb54e31d25d95fd3,Дурабейз 2.0,База,false,4301,-14631,dyrachito,false,499,false,537,-1828,06.04.2024,false,2024-04-06T13:39:56.249Z,2024-04-06T14:48:40.847Z,red,<p>Хайповая база</p>,true
1250,0,6610704abb54e31d25d95ad0,"""OTS""",База,false,5800,-5800,OTTYSS,false,260,false,707,-729,06.04.2024,false,2024-04-05T21:42:34.868Z,2024-04-05T21:42:34.868Z,red,<p>Тут Единороги пьют пиво</p>,false
1249,0,6610372abb54e31d25d958e4,td98,База,false,11780,-9441,tuid_,false,249,false,1465,-1172,05.04.2024,false,2024-04-05T17:38:50.572Z,2024-04-06T13:12:21.061Z,green,<p>База td98</p>,false
1248,0,66100dcdbb54e31d25d95379,NewChina,Город,false,-882,-7816,mrKAMEH,false,150,false,-110,-977,05.04.2024,false,2024-04-05T14:42:21.043Z,2024-04-05T14:42:21.043Z,red,<p>Город в подвале</p>,false
1247,0,660fe2b7bb54e31d25d9526b,Територрия Шулиона,База,false,6768,-34871,MasterShulion,false,1650,false,846,-4358,05.04.2024,false,2024-04-05T11:38:31.612Z,2024-04-05T11:38:31.612Z,red,<p>Ну это база для ферм там всяких и я там домик построю </p><p></p>,false
1246,0,660d3ddb70dd107c9fc3c6e1,Ferma,База,false,1300,26099,Antarctic19,false,1500,false,165,3260,04.04.2024,false,2024-04-03T11:30:35.843Z,2024-04-03T11:30:35.843Z,yellow,<p>основная база</p>,false
1245,0,660d389670dd107c9fc3c4a7,База-основа,База,false,-36000,-36000,Mr4ay,false,2000,false,-4500,-4500,04.04.2024,false,2024-04-03T11:08:06.772Z,2024-04-03T11:08:06.772Z,yellow,"<p>Фермы, склад и прочее</p>",false
1244,0,660d158a70dd107c9fc3c12e,Армадилдо,Город,false,-27897,7206,satretar,false,1500,false,-3484,907,03.04.2024,false,2024-04-03T08:38:34.060Z,2024-04-03T08:38:34.060Z,blue,<p>Ковбойский городок для отыгрывания рп</p>,false
1243,0,660b065870dd107c9fc3ab28,Запретка TheKrav,База,false,249,-37423,TheKrav,false,500,false,39,-4692,01.04.2024,false,2024-04-01T19:09:12.733Z,2024-04-01T19:09:12.733Z,red,<p>-</p>,true
1242,0,660ab58470dd107c9fc3a72e,МАКСИ СИТИ,Город,false,-24550,4180,_GoldTerby_,false,1350,false,-3068,522,01.04.2024,false,2024-04-01T13:24:20.395Z,2024-04-01T15:15:00.132Z,blue,<p>Очень ламповы город. Основная тематика - кино и все что с ним связано. По поводу вступления писать Мэру</p>,false
1241,0,660808ee70dd107c9fc39a1c,Гига тера под артики,База,false,-385,-11204,kAmEnNiY,false,2000,false,-52,-1408,30.03.2024,false,2024-03-30T12:43:26.376Z,2024-04-28T16:46:08.943Z,red,"<p>Чиста под арты, шоб ари хаслить с олухов</p><p></p>",true
1240,0,6605d26c70dd107c9fc37e74,krematoriy,База,false,5239,-239,MayScrenson,false,300,false,666,-42,28.03.2024,false,2024-03-28T20:26:20.479Z,2024-03-28T20:26:20.479Z,green,<p>Территория там база все дела</p>,true
1237,0,6605881470dd107c9fc37701,база нейлай,База,false,7104,7743,neylayn,false,160,false,946,994,28.03.2024,false,2024-03-28T15:09:08.295Z,2024-03-28T15:09:08.295Z,yellow,<p>основная база neylayn</p>,true
1236,0,66054b8770dd107c9fc36fe9,Приватная База,База,false,-26179,236,Bulat_SP,false,150,false,-3274,21,26.03.2024,false,2024-03-28T10:50:47.585Z,2024-03-28T10:50:47.585Z,blue,<p>Просто база для одного человека</p>,false
1235,0,6604598f70dd107c9fc363d0,"ХАЙПУЛЯНДИЯШ,М,К,В",База,false,-10922,-192,VerDN,false,600,false,-1373,-19,27.03.2024,false,2024-03-27T17:38:23.797Z,2024-03-27T17:38:23.797Z,blue,<p>КРУТАЯ ТЕРА( ЗАПРЕТКА)</p>,true
1234,0,66043cba70dd107c9fc3621f,Ферма мешков,База,false,-1279,18811,NEKTORUN,false,200,false,-147,2359,27.03.2024,false,2024-03-27T15:35:22.573Z,2024-03-27T16:14:30.666Z,yellow,<ul><li><p>  -</p></li></ul>,true
1233,0,6602e6e570dd107c9fc35291,Фармилка опита,База,false,-1325,18383,NEKTORUN,false,30,false,-150,2307,26.03.2024,false,2024-03-26T15:16:53.043Z,2024-03-27T16:14:09.985Z,yellow,"<p>Ну типа построил ферму опыта, хочусделать её официал-ьной</p>",true
1232,0,6601b4e670dd107c9fc33f04,ТЕРАСИТИ,База,false,-23345,910,qurouq,false,2000,false,-2912,103,25.03.2024,false,2024-03-25T17:31:18.797Z,2024-03-25T17:31:18.797Z,blue,<p>База йоу</p>,false
1231,0,6601acfc70dd107c9fc33e09,Абу_Даби,База,false,-15966,-98,Abu_Dabi21_iz_GY,false,2000,false,-2001,-18,25.03.2024,false,2024-03-25T16:57:32.176Z,2024-03-25T16:57:32.176Z,blue,<p>база жеская</p>,false
1229,0,660041bd70dd107c9fc33280,БобраСИТИ,Город,false,-1850,200,Mladshiyy,false,200,false,-216,12,24.03.2024,false,2024-03-24T15:07:41.019Z,2024-03-24T15:07:41.019Z,blue,<p>Живут талантливые бобры бобры умельцы готовые выгрысть любое дерево за вознагрождение</p>,false
1228,0,65ffadac70dd107c9fc32d73,ФазерИндестри,База,false,-20327,2808,Fazer__,false,99,false,-2546,344,24.03.2024,false,2024-03-24T04:35:56.104Z,2024-03-24T04:35:56.104Z,blue,<p>Ферма спрутов</p>,false
1227,0,65fea186cc978cb29a2c61f5,PLOTINO BOBRA,База,false,1400,-35660,mankabober,false,1000,false,183,-4469,23.03.2024,false,2024-03-23T09:31:50.292Z,2024-03-23T09:31:50.292Z,red,<p>...</p>,true
1226,0,65fe8ec1cc978cb29a2c6137,Великая стройка,База,false,-31700,-3800,PaIach,false,2000,false,-3960,475,23.03.2024,false,2024-03-23T08:11:45.159Z,2024-03-23T08:11:56.079Z,blue,"<p>Задел на город, стройка</p>",false
1225,0,65fe57cfcc978cb29a2c6023,База лютого хайпа,База,false,255,-33600,TverdniyZnak,false,500,false,40,-4198,23.03.2024,false,2024-03-23T04:17:19.683Z,2024-03-23T12:19:11.744Z,red,<p>Жить буду ферма строить буду</p>,true
1224,0,65fdc553cc978cb29a2c5ab1,Ереван,Город,true,-350,16000,SeniorCardenas,false,2000,false,-50,2000,06.10.2022,false,2024-03-22T17:52:19.464Z,2024-04-01T18:44:16.901Z,yellow,<p>Возрождение легенды. Добро пожаловать в лучший город-курорт СП</p>,false
1223,0,65fb3e22cc978cb29a2c3c0c,Посёлок Городского Типа,Город,false,-1518,14597,Dokedo_,false,342,false,-189,1818,20.03.2024,false,2024-03-20T19:50:58.925Z,2024-03-20T19:50:58.925Z,yellow,"<p>Город топи, чил дрил пил, реальный свег, +вайб. Вступайте!</p>",false
1222,0,65fb03facc978cb29a2c3577,ЧВК Еблан,База,false,341,-15019,n0werty,false,245,false,40,-1879,20.03.2024,false,2024-03-20T15:42:50.117Z,2024-03-20T15:42:50.117Z,red,<p>Просто база в которой мы собираемся обустроиться и кайфовать с моими друзьями.</p>,true
1221,0,65f857b4cc978cb29a2c21c7,Лесорубка ТФ2,База,false,-906,-7885,mrKAMEH,false,250,false,-113,-985,18.03.2024,false,2024-03-18T15:03:16.545Z,2024-03-18T15:03:16.545Z,red,<p>Копай бревно покупай улучшения.</p>,false
1220,0,65f6d055cc978cb29a2c0a3c,Зимняя кибитка,База,false,-1562,18155,17.03.2024,false,150,false,-195,2269,17.03.2024 ,false,2024-03-17T11:13:25.184Z,2024-03-17T11:13:25.184Z,yellow,<p>Обычная холостятская база находящясь в зимнем</p>,false
1219,0,65f6c891cc978cb29a2c09b1,Личная Гавань,База,false,32000,-6100,Dimint,false,1000,false,4030,-720,17.03.2024 ,false,2024-03-17T10:40:17.227Z,2024-03-17T11:13:37.154Z,green,<p>Личная база</p>,false
1218,0,65f5b1e1cc978cb29a2bffb6,Ленинград,Город,false,903,17450,Serpow,false,500,false,5,2160,16.03.2024,false,2024-03-16T14:51:13.600Z,2024-03-16T15:47:39.291Z,yellow,"<p>Город, в стиле советской эпохи 60-ых</p>",false
1217,0,65f555abcc978cb29a2bfab1,ХАЙП CITY,Город,false,-3975,-12568,chipollone,false,200,false,-12,-1573,16.03.2024,false,2024-03-16T08:17:47.821Z,2024-04-01T18:03:01.667Z,red,<p>САМЫЙ ХАЙПОВЫЙ ГОРОД НА СВЕТЕ КУНЕМ ВОРОТ СПАСАЙ СВОЙ ГОРОД</p>,false
1216,0,65f54a57cc978cb29a2bf983,База моя,База,false,-29500,36000,0_MAYTE_0,false,1500,false,-3690,4500,16.03.24,false,2024-03-16T07:29:27.636Z,2024-03-16T07:29:27.636Z,yellow,<p>-</p>,false
1215,0,65f4407bcc978cb29a2bee47,Делламур,Город,true,-9580,-1920,Gorynex,false,1000,false,-1213,-242,15.03.2024,false,2024-03-15T12:35:07.654Z,2024-04-11T18:11:15.962Z,blue,<p>-</p>,false
1214,0,65f1a625cc978cb29a2bcbc9,Гикбаровск,Город,false,-27770,-7180,Voolser,false,999,false,-3475,-897,13.03.2024,false,2024-03-13T13:12:05.332Z,2024-03-18T17:20:57.801Z,blue,<p>Город слакдкого пара и густой жижки</p>,false
1213,0,65f0af3dcc978cb29a2bc580,Ильверморни,Город,false,-15333,-33429,Cera_Hogwarts,false,2000,false,-1924,-4170,12.03.2024,false,2024-03-12T19:38:37.880Z,2024-03-12T19:38:37.880Z,red,<p>Описание: Школа волшебства и чародейства</p><p></p>,false
1212,0,65f0ac5dcc978cb29a2bc4dd,Паучий Парк🕷,База,false,15000,-2500,Vijihro,false,1400,false,1880,-305,12.03.2024,false,2024-03-12T19:26:21.138Z,2024-03-12T19:26:21.138Z,green,"<p>Резиденция Vijihro, и по совместительству огромный уютный парк посвящённый моей возлюбленной!</p>",false
1211,0,65ef0679ff524b484dce895e,DibDark,База,false,371,35,artikbuz,false,2000,false,14761,6615,11.03.2024,false,2024-03-11T13:26:17.183Z,2024-03-11T13:26:17.183Z,green,<p>лучшащая крепость на сп)</p>,false
1210,0,65ee181fff524b484dce8661,Дуррабейз,База,false,1822,-37122,dyrachito,false,250,false,227,-4640,10.03.2024,false,2024-03-10T20:29:19.601Z,2024-03-10T20:29:19.601Z,red,<p>САМОЕ ЛУЧШЕЕ МЕСТООО В МИРЕЕ ХАЙП</p>,true
1209,0,65ee0ad1ff524b484dce85ab,Дурабейз,База,false,1822,-37122,dyrachito,false,249,false,227,4640,10.03.2024,false,2024-03-10T19:32:33.230Z,2024-03-10T19:32:33.230Z,yellow,<p>Хайповое место для жительства меня.</p>,true
1208,0,65ed8556ff524b484dce7fc9,Ещё одна терра,База,false,-2040,-27821,Budashka,false,512,false,-241,-3445,10.03.2024,false,2024-03-10T10:03:02.083Z,2024-04-11T17:36:20.503Z,red,<p>ещё одна ферма</p>,true
1207,0,65ec9723ff524b484dce797a,Министерство хайпа,Город,true,4130,-1270,BLYADSTV0,false,1000,false,515,-157,10.03.2024,false,2024-03-09T17:06:43.229Z,2024-03-17T18:50:24.375Z,green,<p>-</p>,false
1206,0,65ec74daff524b484dce7759,Ферма аров,База,false,2400,12000,MoreprodyctZifir,false,199,false,300,1500,09.03.2024,false,2024-03-09T14:40:26.480Z,2024-03-09T14:40:26.480Z,yellow,<p>ферма аров</p>,false
1205,0,65eb7212ff524b484dce6f35,ZAZNAYA,Город,true,10130,30221,W1ry,false,2000,false,1273,3787,08.03.2024,false,2024-03-08T20:16:18.900Z,2024-03-21T17:21:45.723Z,yellow,<p>Напас лютый хапаем постоянно</p><p>вход 1000 ар</p><p>выход 2000 ар</p>,false
1204,0,65ea1473ff524b484dce6368,Терра лехи навального,База,false,-21600,-112,Lesha_Navalniy,false,1000,false,-2700,-14,07.03.2024,false,2024-03-07T19:24:35.635Z,2024-03-07T19:41:26.248Z,blue,<p>Штаб навального(ФБК(Дворец путина))</p>,true
1200,0,65e9fdd8ff524b484dce60c1,Тютютютю,База,false,-30125,-700,1mf_,false,1000,false,3765,-105,07.03.2024,false,2024-03-07T17:48:08.541Z,2024-03-07T17:55:44.004Z,green,<p>-</p>,true
1199,0,65e9d431ff524b484dce5f15,ферма чернил 2210,База,false,-276,35950,agent2210,false,200,false,-45,4502,07.03.2024,false,2024-03-07T14:50:25.021Z,2024-03-07T14:51:00.886Z,yellow,<p>ферма чернил запретка</p><p></p>,true
1198,0,65e76ef4ff524b484dce502c,Тера HONDЫ,База,true,7780,-24869,_Tipsik_mur420,false,500,false,973,-3100,06.03.2024,false,2024-03-05T19:13:56.170Z,2024-03-05T19:13:56.170Z,red,<p>Территория красивая унаследовал ее да.</p>,true
1197,0,65e679acff524b484dce4754,ТитькаГрад,Город,false,-224,-36163,kuixl,false,1499,false,-22,-4533,05.03.2024,false,2024-03-05T01:47:24.139Z,2024-03-05T01:47:24.139Z,red,<p>Любители больших...</p>,false
1196,0,65e5d6ca25109037cbdd4b4b,База ugly_Baraka,База,false,-388,30919,ugly_Baraka,false,1000,false,-42,3852,04.03.2024,false,2024-03-04T14:12:26.999Z,2024-03-04T14:15:07.063Z,yellow,<p>Личная база игрока ugly_Baraka </p><p>для ферм и личного пользования</p>,true
1195,0,65e46a9625109037cbdd3371,???,База,false,-30500,-25500,_AntiLag,false,1500,false,3812,3186,03.03.2024,false,2024-03-03T12:18:30.728Z,2024-03-03T12:18:30.728Z,green,<p>-</p>,false
1190,0,65e464c425109037cbdd3222,Outer Heaven Motherbase,База,false,-1400,-10247,Kart04ka,false,500,false,-177,-1286,03.03.2024,false,2024-03-03T11:53:40.059Z,2024-04-28T13:38:59.657Z,red,<p>Сеть вышек в океане для военных целей</p><p></p>,false
1188,0,65e374bf25109037cbdd2a37,Подвальчик Канфи,Город,true,6000,-8100,Felix0012,false,601,false,700,-1010,02.03.2024,false,2024-03-02T18:49:35.236Z,2024-03-02T18:49:35.236Z,red,<p>владелец felix0012 который живёт в подвале</p>,false
1187,0,65e3532925109037cbdd2946,Мурбург,Город,false,-25440,-3805,LazarusDreik,false,1000,false,-3166,-478,02.03.2024,false,2024-03-02T16:26:17.656Z,2024-03-02T16:26:57.897Z,blue,"<p>Город для котят и других. Подразумевается как</p><p>город для Фурри,но</p><p>вступить может каждый</p><p></p>",false
1185,0,65e1fd5225109037cbdd1a60,Подвальчик Канфи,Город,true,-30300,-2525,kanfi_,false,600,false,-3795,-301,01.03.2024,false,2024-03-01T16:07:46.836Z,2024-03-01T16:07:46.836Z,blue,<p>https://discord.gg/Uyqnzjpkzk</p>,false
1184,0,65e1f8b925109037cbdd1a34,Генштаб,Город,true,-1054,-9487,cuteshamilik,false,1500,false,-140,-1177,01.03.2024,false,2024-03-01T15:48:09.611Z,2024-03-01T15:48:09.611Z,red,<p></p>,false
1183,0,65e1d52f25109037cbdd18d8,Солепач,Город,false,-564,-36660,Shaylushai,false,750,false,-70,-4584,01.03.2024,false,2024-03-01T13:16:31.357Z,2024-03-01T13:16:31.357Z,red,<p>Город со стимпанк стилистикой</p>,false
1182,0,65e0dd0225109037cbdd10da,Подвальчик Канфи,Город,false,-2541,-14549,kanfi_,false,500,false,-312,-1808,29.02.2024,false,2024-02-29T19:37:38.863Z,2024-02-29T19:37:38.863Z,red,<p>-</p>,false
1181,0,65e0cbe625109037cbdd100f,OnyPrism,Город,true,-11000,-24000,OnyTryss,false,1000,false,-1500,3000,29.02.2024,false,2024-02-29T18:24:38.979Z,2024-03-14T15:14:26.347Z,yellow,"<p>Футуристический остров, занимающийся медициной.</p>",false
1180,0,65e0abc725109037cbdd0f08,База Slizni,База,false,4194,28243,Slizni,false,500,false,524,3530,29.02.2024,false,2024-02-29T16:07:35.121Z,2024-02-29T16:07:35.121Z,yellow,<p>База посреди вишни и полян</p>,false
1178,0,65e0874d25109037cbdd0b7c,База игрока legzy_,База,false,-4500,18000,legzy_,false,500,false,-565,2240,29.02.2024,false,2024-02-29T13:31:57.651Z,2024-02-29T13:36:27.079Z,yellow,<p>База которая в будущем превратится в город</p>,false
1177,0,65ddf32e25109037cbdcfce4,Комплекс лямбда,База,false,-23059,21507,_DuckFry_,false,2000,false,-2884,2689,27.02.2024,false,2024-02-27T14:35:26.721Z,2024-02-27T14:35:56.960Z,blue,<p>Территория для личного использования </p>,true
1176,0,65dca39625109037cbdcf7ea,D&D,База,false,-3493,-1699,green_org,false,300,false,-431,-431,26.02.2024,false,2024-02-26T14:43:34.800Z,2024-02-26T14:43:34.800Z,yellow,<p>Тупо база и игры D&amp;D</p>,false
1175,0,65dbac9825109037cbdcf5d4,BasedMen base,База,false,-8800,-18500,ChayHot,false,1500,false,-2310,-910,15.01.2024,false,2024-02-25T21:09:44.712Z,2024-02-25T21:09:44.712Z,blue,<p>База мужыцких мужчин</p>,false
1174,0,65db330425109037cbdcef9f,VirysLend,Город,true,37,-37486,JUSTINHAJHJAHJHA,false,2000,false,4,-4686,25.02.2024,false,2024-02-25T12:31:00.026Z,2024-02-29T13:42:20.355Z,red,<p>-</p>,false
1173,0,65da0f7c25109037cbdce5c4,Орава,База,false,-7200,-2021,Marabr3,false,300,false,-900,-250,24.02.2024,false,2024-02-24T15:47:08.838Z,2024-02-24T15:47:08.838Z,blue,<p>Орава - база двух людей</p><p>Marabr3 и</p><p>Kiroshgenka</p><p>на ней будут хранит</p><p>ь ресурсы и возможн</p><p>о фармилки для зараб</p><p>отка аров</p>,false
1172,0,65d9f74525109037cbdce0c8,База Сахара,База,false,10944,268,Sugarkiller423,false,1000,false,1375,32,26.02.2024,false,2024-02-24T14:03:49.421Z,2024-02-24T14:05:37.298Z,green,<p>Сасать + лежать</p>,true
1171,0,65d9e73325109037cbdcde4a,Purgatorium,Город,false,22498,-7348,Wh1t3cross,false,150,false,-929,2812,24.02.2024,false,2024-02-24T12:55:15.133Z,2024-03-10T17:50:31.230Z,yellow,<p>Полуразрушенный</p><p>город в постсоветской</p><p>тематике</p>,false
1170,0,65d8dec325109037cbdcd616,секретная дача веозли,База,false,-1624,472,Veozly,false,500,false,-204,59,24.02.2024,false,2024-02-23T18:06:59.380Z,2024-02-23T18:08:00.783Z,blue,<p>-</p>,true
1169,0,65d8da2725109037cbdcd583,мапартики квартикса,База,false,2431,27643,1quartix1,false,600,false,304,3435,24.02.2024,false,2024-02-23T17:47:19.102Z,2024-03-07T14:29:41.783Z,yellow,<p><strong>место для постройки самых хайповых артов</strong></p>,true
1168,0,65d7e48325109037cbdccf29,Перетория,База,false,-1646,11902,moreprodyctZifir,false,2000,false,300,300,23.02.2024,false,2024-02-23T00:19:15.338Z,2024-02-23T00:19:15.338Z,yellow,"<p>Территория, состоящая из полотен для артов</p>",false
1167,0,65d7d1e425109037cbdcce37,база ougiiuu,База,false,1655,-14480,ougiiuu,false,2000,false,206,-1820,23.02.2024,false,2024-02-22T22:59:48.924Z,2024-02-22T22:59:48.924Z,red,<p>я живу на острове.. крута!</p>,false
1166,0,65d637d725109037cbdcc07a,Мой подвал,Город,false,-3200,-6200,kanfi_,false,100,false,-397,-775,21.02.2024,false,2024-02-21T17:50:15.604Z,2024-02-27T20:26:57.368Z,red,<p>Тут живут мои подвалыши</p>,true
1165,0,65d4f91525109037cbdcb4f7,Горы красивые,База,false,-1290,-27761,Budashka,false,500,false,-586,-4388,12.02.2024,false,2024-02-20T19:10:13.496Z,2024-04-11T17:36:09.886Z,red,<p>Крутая зона ферм</p>,true
1164,0,65d4f6b325109037cbdcb3e8,терра lamamow'а,База,false,-4192,-17,lamamow,false,128,false,-520,-17,20.02.2024,false,2024-02-20T19:00:03.663Z,2024-02-20T19:00:03.663Z,blue,<p>-</p>,false
1163,0,65d4f5fc25109037cbdcb36b,#Q1,База,false,-4693,-35111,Quan1ks,false,1000,false,-586,-4388,18.02.2024,false,2024-02-20T18:57:00.451Z,2024-02-22T21:42:53.527Z,red,<p>-</p>,false
1162,0,65d4f4eb25109037cbdcb2fb,Стрингленд,База,false,-9629,21841,HypeTop,false,598,false,-1188,2729,20.02.2024,false,2024-02-20T18:52:27.191Z,2024-02-20T18:52:27.191Z,yellow,<p>База HypeTop</p>,false
1160,0,65d4a1b225109037cbdcaa23,Деревня бумбум,База,false,-25516,-834,_zoning_,false,600,false,-3187,-108,20.02.2024,false,2024-02-20T12:57:22.265Z,2024-02-20T13:04:07.997Z,blue,<p>Объединение зумеров для строительства ферм  других благ для прикольной жизни.</p>,false
1159,0,65d488c625109037cbdca7a3,BubbleCity,Город,true,7382,-1816,Danottelo,false,700,false,932,-213,20.02.2024,false,2024-02-20T11:11:02.323Z,2024-02-28T10:52:45.268Z,green,<p>Город состоящей из сладостей и позитива</p>,false
1158,0,65d3bc3625109037cbdca500,ОПБ,Город,false,-3254,9086,ProstoSlogno,false,2000,false,-402,1137,19.02.24,false,2024-02-19T20:38:14.756Z,2024-02-19T20:38:14.756Z,yellow,<p>Организация против </p><p>банд.</p>,false
1157,0,65d38528c4b8107eaae0ec94,Нью-Крони,Город,false,12409,3984,McQejathOFF,false,850,false,1554,498,19.02.2024,false,2024-02-19T16:43:20.683Z,2024-02-20T10:31:09.686Z,green,<p>Волшебный городок сказок</p>,false
1156,0,65d3814ec4b8107eaae0eb60,О тут пляж,База,false,-1501,-29289,Budashka,false,400,false,-188,-3661,18.02.2024,false,2024-02-19T16:26:54.628Z,2024-04-11T17:35:57.247Z,red,<p>Тут ферма жабок</p>,true
1155,0,65d24dfac4b8107eaae0d2de,Бибки,Город,false,4000,2400,alekseev1ch,false,250,false,500,298,18.02.2024,false,2024-02-18T18:35:38.500Z,2024-03-23T11:15:48.459Z,green,<p></p>,false
1154,0,65d1fb1dc4b8107eaae0c2f8,ТДП,База,false,33351,-554,d1kknya,false,1500,false,4169,-65,18.02.2024,false,2024-02-18T12:42:05.457Z,2024-02-18T12:42:05.457Z,green,<p>эщкерее</p>,false
1153,0,65d0e98fc4b8107eaae0ba43,П.Э.П.С.,База,false,-26730,-15984,Spilya,false,2000,false,-3341,-1998,17.02.2024,false,2024-02-17T17:14:55.543Z,2024-03-06T20:38:41.529Z,blue,<p>Территория П.Э.П.С</p>,true
1152,0,65cf98c6c4b8107eaae0b38f,ПИК,База,false,33520,22975,A512,false,315,false,4190,2870,16.02.2024,false,2024-02-16T17:17:58.029Z,2024-02-16T17:17:58.029Z,green,<p>Запретка</p>,true
1151,0,65cf8edbc4b8107eaae0b0b0,База HCDAP,База,false,1134,11929,lleeska_my_kotik,false,500,false,141,1488,16.02.2024,false,2024-02-16T16:35:39.533Z,2024-02-16T16:35:39.533Z,yellow,<p></p>,false
1150,0,65cf87cbc4b8107eaae0af87,Бирюзовая Гавань,Город,true,7491,5000,Gribosvet,false,550,false,964,698,16.02.24,false,2024-02-16T16:05:31.789Z,2024-02-16T16:05:31.789Z,green,<p>Город учёных в стиле морского модерна</p>,false
1149,0,65cf455bc4b8107eaae0aebc,Фабрика Мурмурк,База,false,16500,14500,_MaD_CaT_,false,399,false,2062,1812,16.02.2024,false,2024-02-16T11:22:03.950Z,2024-02-20T12:14:15.801Z,green,<p>Фабрика по изготовлению всего и вся</p>,true
1148,0,65ce5f18c4b8107eaae0aaa5,Терра YPTA_,Город,false,37017,3446,YPTA_,false,500,false,4629,429,15.02.2024,false,2024-02-15T18:59:36.728Z,2024-02-15T18:59:36.728Z,green,<p>терра с фермамы складом личними</p><p>ресами</p>,false
1146,0,65c7bc36c4b8107eaae072dd,Метро-Сити,Город,false,-180,-7210,KysokP,false,400,false,-15,-890,10.02.2024,false,2024-02-10T18:11:02.443Z,2024-03-02T19:27:07.174Z,red,<p>старая заброшеная шахта метро2</p>,false
1145,0,65c7b597c4b8107eaae07231,NevaRuSs,База,false,-11876,2263,NevaRuSs,false,2000,false,-1488,277,10.02.2024,false,2024-02-10T17:42:47.959Z,2024-02-10T17:42:47.959Z,blue,<p>-</p>,true
1144,0,65c7b3bcc4b8107eaae0717c,Rosenbourg,База,false,17587,-6350,MrShnyaga,false,875,false,2227,-846,10.02.2024,false,2024-02-10T17:34:52.910Z,2024-03-22T19:34:04.262Z,green,"<p>Уютный западноевропейский</p><p>городок, строящийся на принципах всенародной демократии.   </p><p></p>",false
1143,0,65c602e4c4b8107eaae050fd,Made in heaven,База,false,-19800,-6700,xeruwim,false,1000,false,-2460,-840,09.02.2024,false,2024-02-09T10:48:04.211Z,2024-02-09T10:48:04.211Z,blue,<p>Место для хайпа</p>,true
1141,0,65c52c4bc4b8107eaae04fcb,запретка кукиша,База,false,28507,-3797,KUKK1,false,900,false,3556,-470,08.02.2024,false,2024-02-08T19:32:27.167Z,2024-02-20T11:40:44.980Z,green,<p>СЕКС ДОМИК KUKK1</p>,true
1139,0,65c509e2c4b8107eaae04df0,База vanend,База,false,3960,6392,vanend,false,152,false,500,780,08.02.2024,false,2024-02-08T17:05:38.614Z,2024-02-08T17:05:38.614Z,yellow,<p>Территория для ферм и построек.</p>,true
1138,0,65c385adc4b8107eaae040ca,Эквестрия,Город,false,16217,25595,Rohanov,false,2000,false,2027,3074,07.02.2024,false,2024-02-07T13:29:17.643Z,2024-03-15T14:53:32.238Z,yellow,<p>-</p>,false
1137,0,65c102a4c4b8107eaae028ac,Консолмун,Город,true,34938,0,CrAsTy,false,1000,false,4368,1,05.02.2024,false,2024-02-05T15:45:40.207Z,2024-02-05T15:47:18.868Z,green,<p>Раньше это был город с лесной чащей. Теперь от этого остались только руины. В зданиях живут культисты в лесу водятся монстры беги пока дышишь.</p>,false
1136,0,65c0e0cec4b8107eaae0224b,Крутая территориииа,База,false,-311,29016,Budashka,false,400,false,-32,-3623,05.02.2024,false,2024-02-05T13:21:18.173Z,2024-02-05T13:21:18.173Z,red,<p>Очень крутаааааа!</p>,true
1135,0,65bffd7dc4b8107eaae01b11, Ezo,База,false,8160,2920,nerick,false,400,false,1020,373,05.02.2024,false,2024-02-04T21:11:25.305Z,2024-02-20T18:59:03.089Z,green,<p>Приватная база.</p><p></p>,true
1134,0,65bd4640c4b8107eaae00e4a,Базка - фигаска,База,false,-298,-4552,grisha_hogmarts,false,1000,false,-34,-573,02.02.2024,false,2024-02-02T19:45:04.377Z,2024-02-02T19:45:04.377Z,red,<p>база двух топов</p>,true
1133,0,65bcc89cc4b8107eaae00b4f,Chmosha,Город,false,-9413,-104,Chmosha,false,1200,false,-1180,-14,02.02.2024,false,2024-02-02T10:49:00.390Z,2024-02-02T10:54:00.973Z,blue,<p>-</p>,false
1132,0,65b7d83fc4b8107eaadfe0d3,База Отдыха,База,false,28207,512, Deaze__,false,500,false,3526,65,29.01.2024,false,2024-01-29T16:54:23.850Z,2024-01-29T16:54:23.850Z,green,<p>-</p>,true
1131,0,65b7b2b2c4b8107eaadfde1d,Мухосранск,База,false,-7109,-26204,Qwensky,false,2000,false,-888,-3275,29.01.2024,false,2024-01-29T14:14:10.710Z,2024-04-29T12:51:00.099Z,red,<p>здесь обитают мухи</p>,true
1130,0,65b69c93c4b8107eaadfd501,Домик гога гиги,База,false,18000,-17300,goga_giga,false,400,false,2250,-2162,28.01.2024,false,2024-01-28T18:27:31.580Z,2024-01-28T18:31:08.392Z,green,<p>Квадратик</p>,true
1129,0,65b67fe0c4b8107eaadfd3cd,Водная яма,База,false,-12687,3858,HACPAL13MoyKotik,false,500,false,-1579,482,28.01.2024,false,2024-01-28T16:25:04.124Z,2024-03-04T13:05:41.732Z,blue,<p>Водная яма</p>,true
1128,0,65b61d9dc4b8107eaadfcb1d,Дача 1quartix1,База,false,-244,8262,1quartix1,false,300,false,-23,1034,28.01.2024,false,2024-01-28T09:25:49.104Z,2024-01-28T09:25:49.104Z,yellow,<p>Маленький островок</p>,true
1127,0,65b3fe4cb53a2297db9b3c1e,Скамск,База,false,-2626,-6211,Unkodero,false,300,false,-330,-750,26.01.2024,false,2024-01-26T18:47:40.612Z,2024-01-26T18:47:40.612Z,red,<p>База базированныз базовичков</p><p></p>,true
1125,0,65b3ea06b53a2297db9b379e,AsariTeam,Город,false,11300,-8300,AsariOwner,false,1500,false,1412,1038,26.01.2024,false,2024-01-26T17:21:10.883Z,2024-01-26T17:21:10.883Z,green,<p>-</p>,false
1124,0,65b3c1e8b53a2297db9b3537,Ушкотопия,Город,false,-27123,969,Youipun,false,1500,false,-3399,176,26.01.2024,false,2024-01-26T14:30:00.409Z,2024-01-26T14:30:00.409Z,blue,<p>Территория под город.</p>,false
1122,0,65b2cbf94866a171914d24ed,Фазенда KV,База,false,-2700,-9111,Unkodero,false,200,false,-337,-1138,26.01.2024,false,2024-01-25T21:00:41.503Z,2024-01-26T18:41:24.437Z,red,<p>Чилловая фазенда на Kрасной Vетке</p>,true
1121,0,65b2ca8f4866a171914d24cf,Фазенда ZV,База,false,-2222,8443,Unkodero,false,200,false,-277,1055,26.01.2024,false,2024-01-25T20:54:39.173Z,2024-01-26T18:41:01.764Z,yellow,<p>Промышленная фазенда за Zолотой Vетке</p>,true
1120,0,65b26fdc6d09a6e1d0e581a2,Депс,База,false,11035,-7990,AsariOwner,false,500,false,1377,-999,25.01.2024,false,2024-01-25T14:27:40.870Z,2024-01-25T14:27:40.870Z,green,<p>-</p>,true
1119,0,65b26e726d09a6e1d0e58180,Зазная,База,false,9532,-8109,AsariOwner,false,400,false,1191,-1014,25.01.2024,false,2024-01-25T14:21:38.013Z,2024-01-25T14:21:38.013Z,green,<p>-</p>,true
1118,0,65b2546d6d09a6e1d0e57d65,Базза,База,false,33407,471,mirm_dobriy,false,2000,false,4176,58,25.01.2024,false,2024-01-25T12:30:37.029Z,2024-01-25T12:30:37.029Z,green,<p>-</p>,true
1117,0,65b0ccca6d09a6e1d0e568fd,Онфийские острова,Город,false,-9953,474,Onfi_,false,300,false,-1256,71,14.10.2023,false,2024-01-24T08:39:38.341Z,2024-03-19T18:37:21.689Z,blue,<p>Острова завоёванные СВО (Совместной виртуальным обьединением)</p><p>БАЗА ЗАПРЕТКА</p>,true
1116,0,65b004a06d09a6e1d0e56379,Н-град,Город,false,-5064,-9681,toshun_iz_NGRADA,false,500,false,-633,-1215,23.01.24,false,2024-01-23T18:25:36.320Z,2024-01-23T18:25:36.320Z,red,<p>национальное достояние сервера</p><p>сп5</p><p>славный городок</p><p>Н-град</p>,false
1115,0,65afd60f6d09a6e1d0e55fc1,Округ Ван,Город,false,20824,-5314,SwagBeast69_,false,600,false,2603,-660,23.01.2024,false,2024-01-23T15:06:55.336Z,2024-01-23T15:06:55.336Z,green,"<p>Округ Ван-город базированный на центральных районах Токио, а также его агломерации. В городе планируется 3 основных района</p>",false
1114,0,65aeceda6d09a6e1d0e55864,База Торфяник Флоу,База,false,21600,23500,DeHustler,false,1000,false,2700,2937,22.01.2024,false,2024-01-22T20:23:54.522Z,2024-01-22T20:23:54.522Z,yellow,<p>-я жаба</p>,true
1113,0,65ae89906d09a6e1d0e5537b,ШКУЛЯКА,База,false,-26100,-5020,Krimsons_2015,false,1000,false,-3265,-619,22.01.2024,false,2024-01-22T15:28:16.776Z,2024-01-22T15:28:16.776Z,blue,<p>-</p>,true
1112,0,65ad72756d09a6e1d0e54b32,Грибник Флоу,База,false,-35200,28000,kengarags,false,2000,false,-4400,3500,21.01.2024,false,2024-01-21T19:37:25.501Z,2024-01-21T19:37:25.501Z,blue,<p>Самый большой грибной остров колонизированный городом Флоу</p>,false
1111,0,65ad23cb6d09a6e1d0e544a4,База,База,false,-8048,-859,McQejathOFF,false,200,false,-1005,-105,21.01.2024,false,2024-01-21T14:01:47.304Z,2024-01-21T14:02:37.059Z,blue,<p>-</p>,true
1109,0,65ad08f76d09a6e1d0e54356,Мира,База,false,-36211,782,lacky_193,false,500,false,-4531,95,21.01.2024,false,2024-01-21T12:07:19.744Z,2024-01-21T12:07:19.744Z,blue,<p>Хранение ресурсов</p>,true
1108,0,65abec486d09a6e1d0e53cc0,Арчи,База,false,31362,3048,senpa_moy_kotik,false,1000,false,3920,376,20.01.2024,false,2024-01-20T15:52:40.278Z,2024-01-20T15:52:40.278Z,green,<p>Тут живут симпы и никого больше</p>,false
1107,0,65aaba8a6d09a6e1d0e53816,Округ Ван(ベイエリア),Город,false,15982,2081,SwagBeast69_,false,500,false,1989,248,19.01.2024,false,2024-01-19T18:08:10.173Z,2024-01-19T18:08:10.173Z,green,"<p>Город в стиле Токио состоящий из трёх районов, располагающийся в заливе.(Вся территория размечена блокам)</p>",false
1106,0,65aa86576d09a6e1d0e5347e,Дача владоса,База,false,-704,29396,Konrel,false,1000,false,-87,3686,19.01.2024,false,2024-01-19T14:25:27.202Z,2024-01-19T14:25:27.202Z,yellow,<p>-</p>,true
1105,0,65a7c0596d09a6e1d0e518db,Мышкин,Город,true,-9413,-104,APCHItik,false,1200,false,-1180,-15,17.01.2024,false,2024-01-17T11:56:09.376Z,2024-03-13T12:48:01.965Z,blue,<p>Город Мышкин-Град волшебный наш!</p>,false
1101,0,65a67c536d09a6e1d0e50a1e,НОНХЕМ,Город,true,800,-6000,_Ye11owBox_,false,1000,false,100,-800,16.01.2024,false,2024-01-16T12:53:39.141Z,2024-01-16T12:56:26.115Z,red,<p>-</p>,false
1100,0,65a59f096d09a6e1d0e505b2,Sound City,Город,false,-18500,-8800,ChayHot,false,1500,false,-2312,-1000,15.01.2024,false,2024-01-15T21:09:29.331Z,2024-01-15T21:09:29.331Z,blue,"<p>Город , основанный на криках падшего ангела после изгнания из рая</p>",false
1099,0,65a40d066d09a6e1d0e4fc43,BeeDrills,Город,false,13467,-6030,Zucch1n1n1,false,799,false,1680,-747,14.01.2024,false,2024-01-14T16:34:14.644Z,2024-01-14T16:34:14.644Z,green,"<p>4 чен, тилип-тилип</p>",false
1098,0,65a40b946d09a6e1d0e4fbd5,Stockholm,Город,false,-1050,-9502,lew3aLHG,false,350,false,-140,-1177,14.01.2024,false,2024-01-14T16:28:04.352Z,2024-01-14T16:28:04.352Z,red,<p>Легендарный город.</p>,false
1097,0,65a3edab6d09a6e1d0e4f78b,Аллиум,Город,true,17464,-2609,McRandomazik,false,500,false,2185,-327,14.10.2022,false,2024-01-14T14:20:27.691Z,2024-02-05T15:34:37.766Z,green,<p>-</p>,false
1094,0,65a3ce0c6d09a6e1d0e4f466,Ромашковая долина,Город,true,309,-14052,newrochka,false,2000,false,35,-1752,05.10.2023,false,2024-01-14T12:05:32.468Z,2024-01-14T12:05:32.468Z,red,"<p>Небольшой город, вдохновлённый Ромашковой долиной из смешариков.</p>",false
1093,0,65a3c2136d09a6e1d0e4f2ed,Отель-курорт Нар'Си,База,true,896,-6627,gatcu,false,1000,false,111,-835,14.01.2024,false,2024-01-14T11:14:27.503Z,2024-04-07T18:19:39.427Z,red,<p>В этом прекрасном месте живут люди.</p>,false
1092,0,65a390e26d09a6e1d0e4f045,ГАНДЖУбас сити,Город,false,-4800,1200,Baziza,false,1000,false,-444,123,14.01.2024,false,2024-01-14T07:44:34.158Z,2024-01-24T19:36:37.001Z,blue,<p>Ганжубас сити брух</p>,true
1091,0,65a2bd7d6d09a6e1d0e4e9f2,Рае,База,false,829,-19084,Frigo_,false,200,false,97,-2385,13.01.2024,false,2024-01-13T16:42:37.428Z,2024-01-13T16:42:37.428Z,red,<p>Маленькая база</p>,true
1090,0,659edadfd2fd4aa87ec15e18,Гваделупа-53,База,false,-2600,1900,2025Nermis,false,450,false,-325,237,10.01.2024,false,2024-01-10T17:58:55.963Z,2024-01-10T17:58:55.963Z,blue,"<p>Пожилая база двух стариков, </p><p>созданная для люто</p><p>го кайфа и раслабона</p>",false
1089,0,659ed808d2fd4aa87ec15e00,Резиденция Раслобона ака НАША РАША 2.0,База,false,-748,-7789,3orka,false,600,false,-79,-970,10.01.2024,false,2024-01-10T17:46:48.864Z,2024-01-10T17:46:48.864Z,red,<p>Ну типа база с фермами и постройками просто ноувей EZZ</p>,true
1088,0,659b12fa06ad88b8618c5709,???,Город,false,-3400,33000,qwnly,false,2000,false,-425,4125,07.01.2024,false,2024-01-07T21:09:14.938Z,2024-01-07T22:07:15.658Z,yellow,<p>???</p>,true
1086,0,659a9207b26c7e900f18cf90,Посо-Сити,Город,true,-12339,-8787,Galina_Sova,false,2000,false,-1550,-1100,20.06.2022,false,2024-01-07T11:59:03.024Z,2024-01-07T11:59:20.275Z,blue,<p>Город великого комедианта сервера под именем Боб!</p>,false
1085,0,659a8f81b26c7e900f18cf2a,citepenis,База,false,28470,857,liquor4k,false,2000,false,3556,107,07.01.2024,false,2024-01-07T11:48:17.830Z,2024-01-07T11:48:17.830Z,green,<p>база для души</p>,true
1084,0,659874f6b394190317242064,База-купол,База,false,-6774,21231,Skadi2706,false,600,false,-850,2660,06.01.2024,false,2024-01-05T21:30:30.106Z,2024-01-05T21:30:30.106Z,yellow,<p>Личная база со всеми удобствами</p>,true
1083,0,65985fcfb394190317241f8d,Соления в тазике,База,false,29000,12000,KuberBR,false,1500,false,3637,1512,05.01.2024,false,2024-01-05T20:00:15.994Z,2024-01-05T20:00:15.994Z,green,<p>База гениев</p>,true
1082,0,65985db4b394190317241f18,WiryReally,База,false,10130,30221,W1ry,false,2000,false,1273,3787,05.01.2024,false,2024-01-05T19:51:16.262Z,2024-01-05T19:51:58.210Z,yellow,<p>-</p>,true
1081,0,65968ef0b394190317240cec,Водники,База,false,6743,-37207,bagrovuy,false,500,false,842,-4670,04.01.2024,false,2024-01-04T10:56:48.503Z,2024-01-04T10:58:13.882Z,red,<p>Фермы и чилл постройки</p>,true
1079,0,659547b0b39419031723f4c9,Рисмунд,Город,true,-5000,4000,Faivs,false,1000,false,-650,520,03.01.2024,false,2024-01-03T11:40:32.997Z,2024-01-03T13:15:19.955Z,blue,"<p>Средневековый город, в котором царствует скандинавская мифология и жители которого поклоняются лисе. В городе 12 районов. Каждый из них уникальный и со своей историей.</p>",false
1078,0,65949267b39419031723eebf,Rarla's land,База,false,5897,9797,Rarka,false,200,false,742,1225,03.01.2024,false,2024-01-02T22:47:03.739Z,2024-01-02T22:47:03.739Z,yellow,<p>42</p>,true
1076,0,65947a55b39419031723e769,База MrsFlyfi,База,false,-27421,-280,MrsFlyfi,false,300,false,-3424,-32,02.01.2024,false,2024-01-02T21:04:21.435Z,2024-01-02T21:04:21.435Z,blue,<p>секретная база</p>,true
1075,0,659418d7b39419031723e1f0,LoVerse,Город,true,-14886,6321,The_Cobalt,false,2000,false,-1859,790,02.01.2024,false,2024-01-02T14:08:23.960Z,2024-01-02T14:08:23.960Z,blue,"<p>Город LoVerse основан на мотивах сюжетных сезонов Lololowk'и. Здесь вы можете найти здания, например из Империи, или Абраксас из Поэны и т.д. Город хайп с кул жителями.</p>",false
1073,0,6594170ab39419031723e179,База krytoi_eblan,База,false,20870,3376,zentyyy228,false,1500,false,2615,417,02.01.2023,false,2024-01-02T14:00:42.404Z,2024-01-02T14:00:42.404Z,green,<p>база для ферм и хранения ресов</p>,true
1072,0,6593e8f2b39419031723de13,OGC town,Город,false,4659,2013,JunOGC_,false,500,false,570,250,28.12.2023,false,2024-01-02T10:44:02.149Z,2024-01-02T10:44:02.149Z,green,<p>Город в стиле дикого запада</p>,false
1071,0,65932dcfb39419031723d73b,карпик,База,false,4260,-33205,Salatik_Oliver,false,700,false,532,-4152,02.01.2024,false,2024-01-01T21:25:35.418Z,2024-03-15T10:19:00.916Z,red,<p>det er ingen gud</p>,false
1070,0,658efc67b39419031723c121,MainX,Город,false,-16584,-1517,RonaldoSuuuui,false,1000,false,-2072,-188,29.12.2023,false,2023-12-29T17:05:43.618Z,2024-01-08T15:43:43.046Z,blue,"<p>Город ютуберов Mainoft и IksX, заходите если вы тоже ютубер, остальные просто посетители)</p>",true
1069,0,658d98ffb39419031723b771,Тэлумбэ,База,false,12683,10535,Lotli,false,200,false,1585,1316,28.12.2023,false,2023-12-28T15:49:19.984Z,2023-12-28T15:49:19.984Z,green,<p>Грибной район Амбенна</p>,false
1068,0,658d9876b39419031723b723,Фаве,Город,false,13200,14400,Nomer82,false,600,false,1650,1800,28.12.2023,false,2023-12-28T15:47:02.943Z,2023-12-28T15:47:02.943Z,yellow,<p>2-ой район Амбенна</p>,false
1067,0,658d8897b39419031723b5c0,Ханко,Город,true,3405,3407,Skibidi_moskit,false,400,false,-370,430,21.12.2023,false,2023-12-28T14:39:19.957Z,2023-12-28T14:44:53.306Z,yellow,<p>Финский город вышедший из за льдов</p>,true
1066,0,658d6b4bb39419031723b20c,База Caukoo,База,false,-17000,-1950,Caukoo,false,1000,false,-2111,-248,28.12.2023,false,2023-12-28T12:34:19.353Z,2023-12-28T12:34:19.353Z,blue,<p>База Caukoo</p>,true
1065,0,658c5e3db39419031723aef6,"3Т_РБ ""ЯСъелДеда""",База,false,5069,31197,Jeleiaka,false,1000,false,641,3893,27.12.2023,false,2023-12-27T17:26:21.004Z,2023-12-27T17:26:21.004Z,yellow,<p>Терра для лютого всасывания ресиков и производства различного кала.</p>,true
1064,0,658c59a9b39419031723aeab,"Синдикат ""Kosher inc.""",Город,false,-2000,8000,MrEvrey4ik,false,2000,false,-245,1000,27.12.2023,false,2023-12-27T17:06:49.967Z,2023-12-27T17:06:49.967Z,yellow,"<p>Синдикат ""Kosher inc."" находится под мафией ""Kosher Nostra"". Чем точно занимается синдикат - неизвестно. Известно одно - это место переполнено преступностью.</p>",false
1063,0,658bf65db39419031723ab4c,ГуряНЯЯЯЯ,Город,false,-28425,13831,Ketchypp,false,2000,false,-3553,1728,27.12.2023,false,2023-12-27T10:03:09.134Z,2023-12-27T10:03:09.134Z,blue,<p>Территория кепуча</p>,true
1062,0,658ad792b39419031723a398,Няшки,База,false,-10570,-13300,DaL1o,false,500,false,-1320,-1666,26.12.2023,false,2023-12-26T13:39:30.283Z,2023-12-26T14:44:22.829Z,red,<p>Няшки</p>,true
1060,0,6589cc1cb394190317239f5f,Холтурия,База,false,-35330,-639,holotry,false,500,false,-4405,4,25.12.2023,false,2023-12-25T18:38:20.926Z,2023-12-25T18:38:20.926Z,blue,<p>Полотно для постройки артов посреди океана</p>,true
1059,0,6589c55cb394190317239f4e,ишаклан,База,false,-958,393,GeForceRTX3060GB,false,300,false,-130,48,25.12.2023,false,2023-12-25T18:09:32.686Z,2023-12-25T18:09:32.686Z,blue,<p>хайповая терра база ишаклана</p>,true
1058,0,6589aaccb394190317239b3e,Дача Финансов,Город,true,-29127,15931,Ketchypp,false,2000,false,-3660,1979,25.12.2023,false,2023-12-25T16:16:12.551Z,2024-02-05T14:14:54.347Z,blue,<p>Уютный город для друзей и в большинстве своём Работников Мин Фина</p>,false
1056,0,6589873fb394190317239429,амонгасик,База,false,-8166,2380,semeone,false,500,false,-1014,290,25.12.2023,false,2023-12-25T13:44:31.157Z,2023-12-25T13:44:31.157Z,blue,<p>запретка</p>,true
1055,0,65889363b394190317238ffc,Цветочная столица,Город,false,-11297,-5313,K0zuki_0den,false,1000,false,-1422,-658,24.12.2023,false,2023-12-24T20:24:03.663Z,2023-12-24T20:24:03.663Z,blue,<p>Регион Вано</p>,false
1054,0,65886c66b394190317238d6c,Фарматти второй район,Город,true,3400,-6950,Dimonloikek,false,800,false,425,-890,24.12.2023,false,2023-12-24T17:37:42.479Z,2024-01-14T15:34:57.967Z,red,"<p>Фарматти - город без общего стиля, связанный с вечностью мира.</p>",false
1053,0,6587de815a1afb2130f52fb9,Old York,База,false,-19000,-11000,Mr_Gemrani,false,2000,false,-2580,-1335,24.12.2023,false,2023-12-24T07:32:17.127Z,2023-12-24T10:07:05.900Z,blue,<p>Old York</p>,true
1052,0,65872dfa5a1afb2130f5232b,Египет,База,false,19650,-6900,aladin2811,false,200,false,2452,-867,23.12.2023,false,2023-12-23T18:59:06.468Z,2023-12-23T19:04:52.180Z,green,<p>пись пись</p>,true
1051,0,6586bbd80b989ad00c0e3b35,Ember,База,false,17100,3100,Noobtik_moykotik,false,2000,false,2121,400,23.12.2023,false,2023-12-23T10:52:08.208Z,2024-01-08T15:55:21.292Z,green,"<p>Распространение цивилизации можно сравнить с огнём, сначала это слабая искра, затем мерцающий огонёк, а потом могущественное пламя, наделённое скоростью и силой.</p>",true
1050,0,6585f2c60b989ad00c0e37bf,Супер секретная база,База,false,-13689,14782,mauffy,false,1000,false,1698,1850,22.12.2023,false,2023-12-22T20:34:14.850Z,2023-12-22T20:37:35.594Z,yellow,<p>База игрока mauffy</p>,true
1048,0,658456312da268eb0278456d,Сбирский Кингдом,Город,true,11430,-4000,Skibidi_Moskit,false,500,false,1440,-732,21.12.2023,false,2023-12-21T15:13:53.747Z,2023-12-21T15:13:53.747Z,green,<p>Город посвящённый великому Сибирскому Кингу из БК.</p>,true
1047,0,65836efc2da268eb02783f40,Жопа Град,Город,false,-2080,9711,Rain_Gosling,false,300,false,-260,1212,21.12.2023,false,2023-12-20T22:47:24.932Z,2023-12-20T22:47:24.932Z,yellow,<p>Город Жопа</p>,false
1046,0,65836c8b2da268eb02783f2c,Болота,База,false,-31651,-115,Likholesye,false,800,false,-3956,-19,21.12.2023,false,2023-12-20T22:36:59.088Z,2023-12-20T22:36:59.088Z,blue,<p>Болота со странным святилищем.</p>,true
1045,0,6581ed032da268eb0278391c,Джамбуляндия,Город,false,-21896,-256,dzhambula,false,2000,false,-2737,-16,19.12.2023,false,2023-12-19T19:20:35.712Z,2023-12-19T19:20:35.712Z,blue,"<p>Город великого,гениального,амбициозного,избранного господом - Джамбулы.</p>",false
1044,0,6581ce042da268eb02783834,Редволл,База,false,-33820,517,Manu_Horek,false,1000,false,-4222,78,19.12.2023,false,2023-12-19T17:08:20.794Z,2023-12-19T17:08:20.794Z,blue,<p>Заготовка под город</p>,false
1043,0,657f24b52da268eb02781d0b,дом red27legend,База,false,-34438,49,red27legend,false,500,false,-4302,18,17.12.2023,false,2023-12-17T16:41:25.135Z,2023-12-17T16:41:25.135Z,blue,<p>-</p>,false
1042,0,657ef8422da268eb02781a7a,Лано,Город,false,12080,-18640,SovushkaOvO,false,650,false,1510,-2330,17.12.2023,false,2023-12-17T13:31:46.074Z,2023-12-17T13:31:46.074Z,red,"<p>Небольшой снежный городок ""Лано"".</p>",false
1041,0,657ec1b52da268eb02781817,Лесничество Ли Юэ,База,false,34000,0,Chung_Yun,false,750,false,4269,0,17.12.23,true,2023-12-17T09:39:01.753Z,2023-12-17T09:39:01.753Z,green,<p>Уютная горная местность в хвойном лесу</p>,false
1040,0,657e46362da268eb027815e5,Терра мономри,База,false,-22000,14000,monomri,false,2000,false,-2750,1750,17.12.2023,false,2023-12-17T00:52:06.387Z,2024-02-17T11:29:47.847Z,blue,<p></p>,true
1039,0,657e42672da268eb0278157a,Терра мономри,Город,false,-20000,10000,monomri,false,2000,false,-2500,1250,17.12.2023,false,2023-12-17T00:35:51.479Z,2024-02-17T11:28:55.803Z,blue,<p></p>,false
1038,0,657c95162da268eb0277f9b3,Андеграунд 2,Город,true,-2131,6600,Ametist_SRP,false,700,false,-280,814,15.12.2023,false,2023-12-15T18:04:06.746Z,2023-12-15T18:04:06.746Z,yellow,<p>Возрождение легенды</p>,false
1036,0,657c73912da268eb0277f700,Новое Иваново,Город,true,-279,36818,Mazay_San,false,120,false,-1,4612,15.12.2023,false,2023-12-15T15:41:05.918Z,2023-12-16T13:31:19.550Z,yellow,<p>Маленькая деревушка в стиле дореволюционных и не очень крестьян</p>,false
1035,0,657a19352da268eb0277dfbd,Arasaka,База,true,36915,-11,YAMA228,false,2000,false,4625,-13,13.12.2023,false,2023-12-13T20:51:01.304Z,2023-12-14T20:49:36.590Z,green,<p>Город в стиле Cyberpank2077</p>,true
1034,0,6579bf5d2da268eb0277d6cd,"Сателлит Города Уродов ""Водная Яма""",Город,true,-10450,2259,Feralitt_,false,500,false,-1304,-282,13.12.2023,false,2023-12-13T14:27:41.787Z,2023-12-15T14:46:57.945Z,blue,<p>Водная яма</p>,true
1033,0,65783e0f2da268eb0277c062,Чебуреки,База,false,-5300,-625,SHIMURAEMOADIDAS,false,150,false,-661,-100,12.12.2023,false,2023-12-12T11:03:43.284Z,2023-12-12T11:03:43.284Z,blue,<p>-</p>,false
1032,0,6576d7dda1d596380e11056e,S1mpSquad,База,true,4783,5888,dilerkot,false,500,false,560,720,11.12.2023,false,2023-12-11T09:35:25.067Z,2023-12-11T09:36:13.261Z,yellow,<p>тут самые крутые живут</p>,false
1031,0,65761159a1d596380e10fe15,База konorip,База,false,37250,4533,konorip,false,1000,false,4658,564,10.12.2023,false,2023-12-10T19:28:25.833Z,2023-12-10T19:28:25.833Z,green,<p>-</p>,false
1029,0,65749326a1d596380e10e8a9,Припять,Город,true,-892,-5472,MaxximusRUS,false,1000,false,-125,-670,15.06.2022,false,2023-12-09T16:17:42.844Z,2023-12-09T16:17:42.844Z,red,<p>-</p>,false
1027,0,6570e2d78a011686b7458206,Город трпил секса,Город,false,1120,-34912,triple_six_x,false,1500,false,139,-4365,07.12.2023,false,2023-12-06T21:08:39.767Z,2023-12-06T21:08:39.767Z,red,<p>Имба город для крутых </p>,false
1026,0,6570bf138a011686b7457f2b,Компашка Ебанутых,База,false,18000,-28000,KE_Kl1n_Shukovv,false,700,false,2250,-3500,06.12.2023,false,2023-12-06T18:36:03.422Z,2024-01-25T17:40:05.497Z,red,<p>Бананчики</p>,true
1025,0,6570a65d8a011686b74576f7,Unelmat,Город,false,3988,8888,muden_bluz,false,1000,false,500,1111,06.12.2023,false,2023-12-06T16:50:37.030Z,2023-12-06T16:50:37.030Z,yellow,<p>бананчики</p>,false
1024,0,65707ddc8a011686b745735f,Воронеж,База,false,-21363,-11873,Olli_FFX,false,1000,false,-2657,-1490,06.12.2023,false,2023-12-06T13:57:48.822Z,2023-12-06T13:57:48.822Z,blue,<p>База дурачков</p>,false
1023,0,656e34e58a011686b7456c4d,NEZPROM INC,База,false,-130,10645,xitriks,false,500,false,-5,1337,05.12.2023,false,2023-12-04T20:21:57.550Z,2023-12-04T20:21:57.550Z,yellow,<p>Офис кайфовый</p>,true
1022,0,656df4fc052ec236a3de1e11,Фармильня,База,false,8388,-12851,V1LaN,false,2000,false,1048,-1607,04.12.2023,false,2023-12-04T15:49:16.920Z,2024-05-03T22:12:31.324Z,red,<p>Закрытая территория ферм</p>,true
1021,0,656def9c052ec236a3de1d53, чилловая территория,База,false,2532,682,KNYAZ_PENZbI,false,200,false,318,83,04.12.2023,false,2023-12-04T15:26:20.191Z,2023-12-04T15:26:20.191Z,green,<p>закрытая</p><p>территория моя а</p>,true
1020,0,656cce02052ec236a3de16fd,New Fallen Kingdom,Город,false,-4542,-1752,LeXFeeD,false,500,false,-580,-280,03.12.2023,false,2023-12-03T18:50:42.522Z,2023-12-03T18:50:42.522Z,blue,<p>жители королевства Fallen Kingdom после крушения замка перебрались через берег и возвели город</p>,false
1019,0,656c98a4052ec236a3de1184,RNSNS,База,false,-25086,7484,_antihype_payasa,false,498,false,-3132,937,03.12.2023,false,2023-12-03T15:03:00.837Z,2023-12-03T15:03:52.864Z,blue,<p>-</p>,true
1018,0,656c945e052ec236a3de0c5f,Типо база ,Город,false,2000,11375,snaker373,false,1799,false,357,1398,11.05.2023,false,2023-12-03T14:44:46.972Z,2023-12-03T14:44:46.972Z,yellow,<p>-</p>,false
1017,0,656a4e22052ec236a3ddedce,Территория Красивая,Город,false,-8047,-857,maxi_capybara,false,200,false,-1004,-104,18.11.2023,false,2023-12-01T21:20:34.969Z,2023-12-01T21:20:34.969Z,blue,"<p>Терра для города, биом берёзовый лес.</p>",false
1016,0,65687d02052ec236a3ddd826,Мастурбург,Город,false,-4198,7314,KeninStone,false,500,false,-524,913,30.11.2023,false,2023-11-30T12:16:02.950Z,2023-11-30T12:16:02.950Z,yellow,<p>Тут живет KeninStone</p>,false
1015,0,65679ded2d1ac7c4edc234d5,Саратовский Край,База,false,-16161,12852,Dukuy_Muzhik,false,800,false,-2021,1602,29.11.2023,false,2023-11-29T20:24:13.312Z,2023-12-19T16:26:17.982Z,blue,<p>-</p>,true
1014,0,65679c812d1ac7c4edc234ba,Байкал,База,false,-8632,-36421,FlowerRadiance,false,99,false,-1066,-4541,29.11.2023,false,2023-11-29T20:18:09.878Z,2023-11-29T20:18:09.878Z,red,<p>-</p>,true
1013,0,656795c22d1ac7c4edc23428,гарем геев,База,false,3152,17909,Qwennnn,false,1999,false,395,2240,29.11.2023,false,2023-11-29T19:49:22.022Z,2023-11-29T19:49:22.022Z,yellow,<p>огромный минион огромный чонон и огромный окулон и еще люблю сару полсон рост алекс воус 182 фуре топи сюда туда и обратно</p>,false
1011,0,65646e2e2d1ac7c4edc1ff7d,Хабаровск,База,false,11050,16150,Wer_ax,false,999,false,1367,2022,27.11.2023,false,2023-11-27T10:23:42.526Z,2023-12-16T08:04:58.516Z,yellow,"<p>Город, частично повторяющий реальный город Хабаровск</p>",true
1010,0,656352502d1ac7c4edc1f6e9,ПитерЛэнд,База,false,-666,37300,agent2210,false,499,false,-80,4653,26.11.2023,false,2023-11-26T14:12:32.714Z,2024-02-24T12:30:48.625Z,yellow,<p>Введите описание</p>,false
1009,0,65632cd62d1ac7c4edc1f1df,Ферма слизи,База,false,23170,-9000,werj_,false,1000,false,2972,-1032,26.11.2023,false,2023-11-26T11:32:38.983Z,2023-11-26T11:32:38.983Z,green,<p>Ферма Слизи</p>,true
1008,0,656324d12d1ac7c4edc1efa5,Нефилим,База,false,647,35037,Septole,false,500,false,80,4379,26.11.2023,false,2023-11-26T10:58:25.496Z,2023-11-26T10:58:25.496Z,yellow,<p>Личная база игрока Septole</p>,true
1007,0,65631cf72d1ac7c4edc1edb4,База с Правдой,База,false,-11250,-9250,AVTO_Savel,false,2000,false,-1437,-1156,26.11.2023,false,2023-11-26T10:24:55.674Z,2023-11-26T10:24:55.674Z,blue,<p>База организации AVTOMOBILIST</p>,true
1006,0,65630d0e2d1ac7c4edc1eb35,терра базизы,База,false,-6695,6612,_Baziza00_,false,500,false,-800,800,03.06.2022,false,2023-11-26T09:17:02.557Z,2023-11-26T09:17:02.557Z,yellow,<p>ну база базовая база база как бы</p>,false
1005,0,6562e6792d1ac7c4edc1ea18,Планина,База,false,-679,-31815,Gorynych,false,450,false,-59,-4000,26.11.2023,false,2023-11-26T06:32:25.036Z,2023-11-26T06:32:25.036Z,red,<p>Дача Gorynych</p>,true
1003,0,65607a332d1ac7c4edc1cccf,Треп-хата Мефа,База,false,-47,9007,_Mef_,false,200,false,-16,1128,24.11.2023,false,2023-11-24T10:25:55.238Z,2024-04-30T18:43:06.917Z,yellow,<p>Жесткий блядушник</p>,false
1002,0,656076372d1ac7c4edc1cb87,Буцефалос,База,false,23135,2802,Mr_Soso4ek,false,700,false,2892,340,24.11.2023,false,2023-11-24T10:08:55.627Z,2023-11-24T10:08:55.627Z,green,<p></p>,true
1001,0,655f47072d1ac7c4edc1ba19,Терра игрока VL,База,false,18180,-900,______________VL,false,2000,false,2270,-115,23.11.2023,false,2023-11-23T12:35:19.686Z,2023-11-23T12:35:19.686Z,green,<p>Топи терра</p>,true
1000,0,655f444e2d1ac7c4edc1b864,Бухенвальд,База,false,17581,-5506,MrSvetskiy,false,200,false,2206,-704,23.11.2023,false,2023-11-23T12:23:42.485Z,2023-11-23T12:23:42.485Z,green,<p>Хайповый пром центр</p>,true
998,0,655cae212d1ac7c4edc190f8,Макарена,База,false,-1215,25847,J3sats3,false,500,false,-155,3219,21.11.2023,false,2023-11-21T13:18:25.554Z,2023-11-21T13:18:25.554Z,yellow,<p>мек шмек</p>,false
997,0,655cac9f2d1ac7c4edc190a4,РосКоп,База,false,36000,2400,Greevele,false,2000,false,4499,300,21.11.2023,false,2023-11-21T13:11:59.685Z,2023-11-21T13:11:59.685Z,green,<p>Терракотово-песчанный карьер игрока Greevele</p>,true
996,0,655ca7d22d1ac7c4edc18f6e,Эчпочмак,База,false,3550,-18845,ZaGorodYrodoV,false,1200,false,444,-2357,21.11.2023,false,2023-11-21T12:51:30.420Z,2023-11-21T12:51:30.420Z,red,"<p>База легенд, филантропов плейбоев милионеров</p>",true
995,0,655bb4b52d1ac7c4edc176c1,Фаршмаки,База,false,-8392,2385,Krabushek,false,1000,false,-1049,293,20.11.2023,false,2023-11-20T19:34:13.637Z,2023-11-20T19:34:13.637Z,blue,"<p>База легенд, филантропов плейбоев милионеров</p>",true
994,0,655925022d1ac7c4edc151a1,ТАЛЕРАНТНЫЕ ДОЛБАЁБЫ,Город,true,-1570,7620,ENTI_,false,2000,false,-195,956,18.11.2023,false,2023-11-18T20:56:34.260Z,2023-11-21T18:24:12.414Z,yellow,<p>ТАЛЕРАНТНЫЕ ДОЛБАЁБЫ ЭТО ВСЁ</p>,false
993,0,6558ccbe2d1ac7c4edc145eb,Лисички,База,false,-427.318,37209.7,eeee5559,false,200,false,-60.425,4664.3,18.11.2023,false,2023-11-18T14:39:58.157Z,2023-11-18T14:39:58.157Z,yellow,"<p>Скалистая местность на вершине, рядом с красивой рекой и деревьями разного вида.</p>",true
992,0,6558c5a02d1ac7c4edc143c3,Realm-Try,База,false,-811,-20560,wolframov0422,false,100,false,-88,2580,18.11.2023,false,2023-11-18T14:09:36.344Z,2023-11-18T14:09:36.344Z,yellow,<p>База wolframov0422 и gabriel_tea</p>,true
990,0,6557cd362d1ac7c4edc12db3,Ядерная подлодка,База,false,1452,3469,Staali_t65,false,680,false,200,444,17.11.2023,false,2023-11-17T20:29:42.003Z,2023-11-17T20:29:42.003Z,yellow,<p>Атомная подлодка на вооружение</p><p>которой иметься </p><p>ядерное оружие и не</p><p>только</p>,true
989,0,65578a9e2d1ac7c4edc120e9,FarmLand,База,false,-196,65,Niguchipvvp,false,500,false,-23,3270,17.11.2023,false,2023-11-17T15:45:34.751Z,2023-11-17T15:45:34.751Z,yellow,"<p>Трахаем тросник, жителей, и вообще все что движеться! Если надо чуть пофармит иди нахер с нашей базы, или же пиши в дискорл владельцу</p>",true
988,0,655694a32d1ac7c4edc117ab,Дача коровы,База,false,5856,-1036,korowwa,false,100,false,744,-129,17.11.2023,false,2023-11-16T22:16:03.323Z,2023-11-16T22:17:59.265Z,green,"<p>Просто дача. Там уютно, лам</p><p>пово, и играет джаз. </p><p>Ну и корова еще живёт</p>",false
987,0,655661502d1ac7c4edc11549,База Cera11,База,false,856,-24572,Cera11,false,200,false,103,-3067,16.11.2023,false,2023-11-16T18:37:04.179Z,2023-11-16T18:37:04.179Z,red,<p>База</p>,false
986,0,65564b2e2d1ac7c4edc11208,База morkoyka & rombzes,База,false,1936,15024,rombzes,false,500,false,242,1878,16.11.2023,false,2023-11-16T17:02:38.082Z,2023-11-16T17:02:38.082Z,yellow,<p>Личная база</p>,true
985,0,65553bc02d1ac7c4edc0fee2,Старый горара раён сашиа санан дрес,Город,false,-8020,-9620,DEBIL228337_,false,700,false,-986,1188,16.11.2023,false,2023-11-15T21:44:32.208Z,2023-11-24T15:39:20.125Z,yellow,<p>Шкопете доп доп доп ес ес дип дип ес доп лол</p>,false
984,0,6554d9642d1ac7c4edc0ef48,des2,Город,true,-2012,-2999,Broccalya,false,2000,false,-251,-374,03.06.2022,false,2023-11-15T14:44:52.345Z,2023-11-16T13:26:17.454Z,red,<p>Второй район Дестена</p><p></p>,false
983,0,6554d8f92d1ac7c4edc0ef36,Острова УУУ,База,false,32000,-36500,Night_S_,false,1000,false,3960,-4626,15.11.2023,false,2023-11-15T14:43:05.794Z,2023-11-15T14:43:05.794Z,red,<p>Уменьшенная версия мира УУУ</p>,false
982,0,6554d7d32d1ac7c4edc0ed5b,Менберг,Город,true,-86,7955,CL1FF_BURT0N,false,250,false,-13,989,15.11.2023,false,2023-11-15T14:38:11.584Z,2023-11-15T14:38:11.584Z,yellow,"<p>Сборная Европа с пышными лесами, горами и полями.</p>",false
981,0,6553be8421e3364d7b63d011,НеЯма,База,false,728,6000,Ragedrivs,false,250,false,95,736,14.11.2023,false,2023-11-14T18:37:56.496Z,2023-11-14T18:37:56.496Z,yellow,<p>База НеЯмы</p>,false
980,0,6553ae5b21e3364d7b63cbf8,Империя Святого Петра,Город,false,-3551,-6767,Turtyk_,false,1500,false,-447,-847,14.11.2023,false,2023-11-14T17:28:59.522Z,2023-11-14T17:28:59.522Z,red,"<p>Печка, расположенная в ледянной пустыне;</p><p>город</p>",false
979,0,65537c613c7d27ee42c5c0fe,База кормит,База,false,-19560,2400,JustTarum,false,720,false,-2445,299,14.11.2023,false,2023-11-14T13:55:45.306Z,2023-11-14T13:55:45.306Z,blue,<p>База кормит</p>,false
978,0,655374533c7d27ee42c5c08e,Разгар-Сити,Город,true,-1486,12640,MRMuckFlurry,false,1200,false,-187,1587,14.11.2023,false,2023-11-14T13:21:23.359Z,2023-11-14T13:21:23.359Z,yellow,<p>Территория Разгара-Сити очень жаркая и огромная.</p>,false
977,0,655130133c7d27ee42c5a5b0,123,База,false,-400,7100,keorii,false,1000,false,-50,888,05.06.2022,false,2023-11-12T20:05:39.746Z,2023-11-17T20:51:51.810Z,yellow,<p>похуйпохуй</p>,false
976,0,654fa52c7c478fd38b968bb6,Небельбург,Город,false,343,37495,Finoker,false,140,false,41,5000,11.11.2023,false,2023-11-11T16:00:44.939Z,2023-11-19T19:56:58.485Z,yellow,<p>Далёкий город ждём всех игроков</p>,false
975,0,654f536d7c478fd38b9688b8,Дом престарелых жителей,База,false,-36909,3684,MrNabuy,false,500,false,-4613,461,11.11.2023,false,2023-11-11T10:11:57.897Z,2023-11-11T10:11:57.897Z,blue,<p>тут жители пушитстого фембоя</p>,true
974,0,654d17744a6aafa5c101c6a5,Тюмень,Город,false,20150,500,Peta20001000,false,500,false,2525,60,09.11.2023,false,2023-11-09T17:31:32.056Z,2023-11-09T17:31:32.056Z,green,<p>Жоский рп ород в котором будет все по рп и здания реальны е 1к1</p>,false
973,0,654d15c04a6aafa5c101c655,Адастра,Город,true,-26900,-1447,Mozarellka,false,1000,false,-3370,-180,09.11.2023,false,2023-11-09T17:24:16.262Z,2023-11-09T17:24:16.262Z,blue,"<p>Адастра это спокойный и ламповый городок,в котором ты можешь отдохнуть от больших городов. Городо находится в биоме сакуры и поэтому постройки в этом городе сделаны в палитре розового цвета</p>",false
969,0,6547f7b476c16edc6dd41277,Богатый район,База,false,36105,536,hai11an,false,800,false,4506,67,05.11.23,false,2023-11-05T20:14:44.558Z,2024-01-16T13:44:28.522Z,green,<p>-</p>,true
968,0,6547f44376c16edc6dd40f89,Frostburg,База,false,-19336,-9000,Yksam_,false,1500,false,-2417,-1125,05.11.2023,false,2023-11-05T20:00:03.360Z,2023-11-05T20:00:13.037Z,blue,Личная база на беспощадном севере.,true
967,0,6547df1176c16edc6dd40d99,Эрлство Ва ргемпшир,Город,true,22768,-2560,JeromeFox ,false,1000,false,2846,-320,05.11.23,false,2023-11-05T18:29:37.082Z,2023-11-05T18:29:37.082Z,green,Оставь надежду всяк сюда  входящий,false
966,0,6547de9b76c16edc6dd40d86,Буба ленд,База,false,10500,-2400,sasibaka123,false,250,false,1322,-308,05.11.2023,false,2023-11-05T18:27:39.480Z,2023-11-05T18:27:39.480Z,green,Буба гэгэг гудка боб,false
965,0,6547d11376c16edc6dd40d48,ТипоЯма,База,false,-309,-10296,___Tipo___lew3a,false,250,false,-26,-1280,06.11.2023,false,2023-11-05T17:29:55.142Z,2023-11-05T17:29:55.142Z,red,Я ебал ваш рот,true
964,0,65469dfe76c16edc6dd40287, няняня^^,База,false,21126,-831,Radowi,false,200,false,2646,-96,04.11.2023,false,2023-11-04T19:39:42.036Z,2023-11-06T18:44:38.534Z,green,няняняняняняняняняняняняняняняняняняняняняняняняняняняняняняняняняняняняняняяняняня,true
963,0,6546854676c16edc6dd40091,Территория _Crepil00_,База,false,616,17373,_Crepil00_,false,500,false,90,2170,04.11.2023,false,2023-11-04T17:54:14.558Z,2023-11-04T17:54:14.558Z,yellow,-,true
962,0,6546707276c16edc6dd3fe4d,Милтон,Город,false,-37,6203,Milyan,false,1000,false,9,762,04.11.2023,false,2023-11-04T16:25:22.191Z,2023-11-04T16:27:49.868Z,yellow,Город сюжета Безликого Тумана ,false
961,0,6543a76076c16edc6dd3e3b6,Скуфбург,База,false,-1054,-9487,Pablorich,false,1500,false,-138,-1177,02.11.2023,false,2023-11-02T13:42:56.486Z,2023-11-02T13:42:56.486Z,red,База скуфов,false
960,0,653ffb4e76c16edc6dd3d07c,Мешок,База,false,27053,-9160,Riktori,false,1500,false,3365,-1136,30.10.2023,false,2023-10-30T18:51:58.286Z,2023-10-30T18:51:58.286Z,green,-,false
958,0,653ea42376c16edc6dd3c944,Крайнеград,Город,false,3272,-13481,f1lyya_,false,555,false,400,-1682,29.10.2023,false,2023-10-29T18:27:47.685Z,2023-11-04T19:19:20.433Z,red,самый луч ший город на сервере p.s любим цифру 69,false
957,0,653d155976c16edc6dd3c086,TRAP CITY,Город,true,13200,-9372,Qfict,false,1500,false,1700,-1167,28.10.2023,false,2023-10-28T14:06:17.890Z,2023-10-28T14:06:17.890Z,green, Это город трэпа и хайпа. Мы на трэпе каждый день и у нас в голове дырка мы дильфин.,false
956,0,653d148c76c16edc6dd3c05e,Несо,Город,true,-1100,-11600,kAmEnNiY,false,2000,false,-148,-1462,18.09.2023,false,2023-10-28T14:02:52.265Z,2024-04-30T07:20:14.275Z,red,Город,false
955,0,653cf9c676c16edc6dd3be6a,база Мellin,База,false,-36760,-3397,Vellin,false,250,false,-4595,-424,28.10.2023,false,2023-10-28T12:08:38.354Z,2023-10-29T17:53:07.902Z,blue,база со складом,false
954,0,653984b476c16edc6dd3a26f,Бункер Эдельвейс,База,false,14184,-3118,Furstkeg,false,250,false,1773,-392,26.10.2023,false,2023-10-25T21:12:20.217Z,2023-10-29T17:53:18.869Z,green,Территория Игрока Furstkeg База для личного проэивания,false
953,0,6536a70376c16edc6dd38f5d,VIP-SIGMA1137,База,false,-3500,28000,kirushkin_TPEHEP,false,2000,false,-437,3500,23.10.2023,false,2023-10-23T17:01:55.896Z,2023-10-23T17:30:55.141Z,yellow,Суетолог-хасаннаторская теретория эщке ре(ПОЛНЫЙ ЭЩКЕРЕ),false
952,0,6536877676c16edc6dd38de2,Гвардия Петра,База,false,10500,-2400,Logmen2078,false,250,false,1322,-308,23.10.2023,false,2023-10-23T14:47:18.496Z,2023-10-23T14:47:18.496Z,green,Личная Терра,false
951,0,653667c776c16edc6dd38ba8, Кровавые доки,База,true,-23000,-6325,ReDyth,false,1000,false,-2873,-790,23.10.2023,false,2023-10-23T12:32:07.025Z,2023-10-23T12:32:07.025Z,blue,База в океане,false
950,0,6535852776c16edc6dd3866f,КОЛБАСА,Город,true,3839,11024,CHUGUN53,false,240,false,480,1377,22.10.2023,false,2023-10-22T20:25:11.822Z,2023-10-29T17:53:34.291Z,yellow,ААААААААААААААААААААААААААААААААААААААААААААААААААААААААААААААААААААААААААААААААААААААААААААААААААААААААААААААААААААААААААААААААААААААААААААААААААААААААААААААААААААААААААААААААААААА,false
949,0,65351d1176c16edc6dd380ec,Земли Ууу,Город,false,-1454,19220,ThePristol,false,2000,false,-174,2394,22.10.2023,false,2023-10-22T13:01:05.981Z,2023-10-22T13:01:05.981Z,yellow,Город по мотивам мультсериала: Время приключений. Где   живут те самые Финн и Джейк и многие  другие,false
948,0,6534347476c16edc6dd377f2,База глеко клана,База,false,-9928,-21950,____glek___yooki,false,1000,false,-1236,-2750,21.10.2023,false,2023-10-21T20:28:36.110Z,2024-01-08T12:51:05.984Z,red,База глеко клана и парижа,true
947,0,6532f0fd60ee338bbd4c14ef,Рогатый берег,База,false,30832,-274,Franken_Stein,false,500,false,3866,-19,21.10.2023,false,2023-10-20T21:28:29.948Z,2023-10-20T21:28:29.948Z,green,бррр брбрврвр,false
946,0,6531b1a760ee338bbd4c07d7,сексмунд,База,false,1648,32623,MISHYTOCHKA,false,2000,false,4077,206,20.10.2023,false,2023-10-19T22:45:59.129Z,2023-10-19T23:04:05.804Z,green,секс - жизнь,true
945,0,653186a560ee338bbd4c0694,"Фермы ""Ватикан shop'a"" N1",База,false,-3500,28000,F0REXS,false,2000,false,-437,3500,19.10.2023,false,2023-10-19T19:42:29.891Z,2023-10-29T17:54:01.940Z,yellow,Лютые фермы для ватикан shop,false
943,0,652c2e7e60ee338bbd4be031,Грибной оcтровок,Город,false,-15765,-28740,Yksam_,false,335,false,-1970,-3585,15.10.2023,false,2023-10-15T18:25:02.812Z,2023-11-02T12:08:14.463Z,red,Грибной остров с пещерами и расщелинами,true
942,0,652c12f460ee338bbd4bdfdd,дачный посёлок,База,false,-11200,15994,Figovy,false,500,false,-1399,2000,15.10.2023,false,2023-10-15T16:27:32.658Z,2023-10-15T16:27:32.658Z,yellow,Здесь находятся дачи так называемых игроков.,false
941,0,652c115260ee338bbd4bdfd0,OhioSquad,Город,true,-30708,362,Try_Kekss,false,250,false,-3838,47,15.10.2023,false,2023-10-15T16:20:34.652Z,2023-10-15T16:20:34.652Z,blue,Поселение древних жителей.,false
940,0,6529b41060ee338bbd4bd30a,дачный посёлок,База,false,17521,-3747,ProstoSlogno,false,1500,false,2192,-455,14.10.2023,false,2023-10-13T21:18:08.590Z,2023-10-13T21:18:08.590Z,green,Здесь находятся дачи так называемых игроков.,false
939,0,6529b3ad60ee338bbd4bd2ed,Молочка,Город,false,-9953,474,MolokoMateri,false,200,false,-1256,71,14.10.2023,false,2023-10-13T21:16:29.158Z,2023-10-13T21:50:20.445Z,blue,"Крутой город, в котором вы сможете строить дома, продавать, и просто спокойно жить)",false
938,0,65297e0c60ee338bbd4bce9a,Авангард,Город,true,-5743,31300,7ZigZag7,false,2000,false,-719,3912,30.09.2023,false,2023-10-13T17:27:40.697Z,2024-04-01T10:48:38.683Z,yellow,<p></p>,true
937,0,65297cfc60ee338bbd4bce24,Яма Типсика,База,false,-4193,-16,AinCube,false,64,false,-520,-16,09.10.2023,false,2023-10-13T17:23:08.841Z,2024-05-05T12:45:21.390Z,blue,<p>Описание отсутсвует.</p>,true
936,0,65297cb760ee338bbd4bcdcf,технобаза69,База,false,-6,20218,vist69,false,2000,false,3,2514,09.10.2023,false,2023-10-13T17:21:59.571Z,2023-10-13T17:21:59.571Z,yellow,"прикольная база, новострой с ме",false
935,0,65297c6660ee338bbd4bcd59,PTwyorker,База,false,5240,-260,intewyorker,false,500,false,666,-40,09.10.2023,false,2023-10-13T17:20:38.189Z,2023-10-13T17:20:38.189Z,green,Частная база  игрока.  В адском стиле.,false
933,0,65297ba860ee338bbd4bccfc,Майами,База,false,26514,7084,RetraY_,false,1500,false,3314,885,05.10.2023,false,2023-10-13T17:17:28.581Z,2023-11-29T13:59:08.725Z,green,Территория сильных людей,false
932,0,65297b6c60ee338bbd4bccef,Территория hellmind,База,false,-3500,28000,hellmind,false,2000,false,-437,3500,05.10.2023,false,2023-10-13T17:16:28.960Z,2023-10-13T17:16:28.960Z,yellow,Территория для ферм,false
930,0,652975e560ee338bbd4bcc73,база игрока werj_,База,false,23850,-11251,werj_,false,1000,false,2980,-1406,13.10.2023,false,2023-10-13T16:52:53.811Z,2023-10-13T16:52:53.811Z,green,подземный город,false
929,0,652974e060ee338bbd4bcc48,ППП,База,false,-37457,119,MARKALLICA,false,1500,false,-5337,10,04.10.2023,false,2023-10-13T16:48:32.032Z,2023-10-13T16:48:32.032Z,blue,Граница мира,false
928,0,6529745d60ee338bbd4bcc23,база игрока promasterkilersn,База,false,-5025,-36330,promasterkilersn,false,500,false,-646,-4540,01.10.2023,false,2023-10-13T16:46:21.199Z,2023-10-13T16:46:21.199Z,red,база на терретории дервни,false
927,0,6529741f60ee338bbd4bcc16,Территория Биткойна,База,false,24250,3900,fiasXD_He,false,1000,false,3030,490,30.09.2023,false,2023-10-13T16:45:19.017Z,2023-10-13T16:45:19.017Z,green,Терра для ферм,false
926,0,652973c760ee338bbd4bcbee,Живописная пещера,База,false,-5121,-23393,NETRONREK,false,365,false,-643,-2938,30.09.2023,false,2023-10-13T16:43:51.924Z,2023-10-13T16:43:51.924Z,red,Тёмный лес и сеть пещер под ним,false
925,0,6529735360ee338bbd4bcbc6,COP,База,false,-32838,-7472,Arimaqqe,false,1500,false,-4114,-929,30.09.2023,false,2023-10-13T16:41:55.856Z,2023-10-13T16:41:55.856Z,blue,Просто база,false
922,0,6529727e60ee338bbd4bcb89,База анкапа,База,false,-5951,-8903,Steka24,false,1000,false,-737,-1100,29.09.2023,false,2023-10-13T16:38:22.419Z,2023-10-13T16:38:22.419Z,red,Анкап,false
921,0,6529723c60ee338bbd4bcb70,ПопускБаза,База,false,9409,1501,PLacidLamb,false,1000,false,1176,187,07.05.2023,false,2023-10-13T16:37:16.753Z,2023-10-13T16:37:16.753Z,green,"Смешное место, смешнявки всякие веселье и все такое морковка и бибизяка.",false
920,0,652971d360ee338bbd4bcb41,Kirito11278,База,false,2825,37499,Kirito11278,false,2000,false,355,5689,28.09.2023,false,2023-10-13T16:35:31.692Z,2023-10-13T16:35:31.692Z,yellow,Собираюсь использовать территорию как базу,false
919,0,6529719c60ee338bbd4bcb25,ВБГ,База,false,-792,-33313,_zdaroova00_,false,1499,false,-98,-4162,27.09.2023,false,2023-10-13T16:34:36.635Z,2024-02-10T17:25:49.159Z,red,Тру база для шахтёров,true
918,0,6529716660ee338bbd4bcb18,Бобриный калл,База,false,-5335,-575,batcof,false,100,false,-655,-80,27.09.2023,false,2023-10-13T16:33:42.858Z,2023-11-22T21:54:32.381Z,blue,"<p>Мы сигмы, ненавидим женщин. Сигма сигма сигма сигма</p>",false
917,0,6529710d60ee338bbd4bcadd,Скибиди водопровод белка великий гинфалор и не превосходный виенти и глава сексастарккок делают бомбом туда сюда собачий волос ,База,false,-969,-19728,V1enti,false,200,false,-121,-2466,26.09.2023,false,2023-10-13T16:32:13.690Z,2023-10-13T16:32:13.690Z,red,чего блять тут база старкакока а виенти тут главный,false
916,0,652970de60ee338bbd4bcac3,База Lecrimer,База,false,19700,-13000,Lecrimer,false,600,false,2416,-1622,26.09.2023,false,2023-10-13T16:31:26.080Z,2023-10-13T16:31:26.080Z,green,Остров с полотном для артов и подводной крепостью,false
914,0,6529707160ee338bbd4bcaa9,П.И.З.Д.Е,База,false,68,32065,Olof_Andersson,false,2000,false,0,4011,25.09.2023,false,2023-10-13T16:29:37.364Z,2023-10-13T16:29:37.364Z,yellow,Пакости И Злодейства Доктора Еврентия База организации Х.У.Я.,false
913,0,65296f9260ee338bbd4bca42,"База ""Shishkarik"" ",База,false,15897,-6424,Shishkarik,false,800,false,1986,-797,24.09.2023,false,2023-10-13T16:25:54.455Z,2024-03-27T12:19:07.836Z,green,Территория принадлежит Shishkarik,false
912,0,65296f4860ee338bbd4bca26,Скай,База,false,11224,-31784,SqworeNAL,false,2000,false,1403,-3973,24.09.2023,false,2023-10-13T16:24:40.841Z,2023-10-13T16:24:40.841Z,red,База,false
911,0,65296f0a60ee338bbd4bca19,Galleta city,База,false,-52,-34202,_Galleta_,false,1500,false,-8,-4300,22.09.2023,false,2023-10-13T16:23:38.805Z,2023-10-13T16:23:38.805Z,red,Личная территория игрока _Galleta_,false
910,0,65296ebb60ee338bbd4bca02,SigmaBASE,База,false,192,6976,wa1ne,false,200,false,35,867,21.09.2023,false,2023-10-13T16:22:19.790Z,2023-11-16T15:43:10.576Z,yellow,<p>V.I.P MEGA УЛЬТРА СИГМА БАЗА СУПЕР МЕГА КРУТЫХ ЧЕЛОВЕК</p>,true
908,0,65296da560ee338bbd4bc9b7,Территория Кенлина,База,false,14000,21000,K7LLY0URS3LF,false,2000,false,1750,2625,20.09.2023,false,2023-10-13T16:17:41.632Z,2023-10-13T16:18:43.970Z,yellow,Отдельная территория Кенлина,false
907,0,65296c2360ee338bbd4bc970,Фермы Кенлина,База,false,14000,17000,WoonReyz,false,2000,false,1750,2125,20.09.2023,false,2023-10-13T16:11:15.172Z,2023-10-13T16:14:42.635Z,yellow,территория для города Кенлин,false
906,0,65296bd960ee338bbd4bc94d,Поезд,База,false,2814,25694,FreshGoat,false,666,false,342,3209,20.09.2023,false,2023-10-13T16:10:01.284Z,2023-10-13T16:10:01.284Z,yellow,Поезд на рельсах,false
905,0,65296ba060ee338bbd4bc8f9,Долина Ландышей,База,false,3480,-32846,Salatik_Oliver,false,500,false,427,-4123,19.09.2023,false,2023-10-13T16:09:04.378Z,2023-10-13T16:09:04.378Z,red,Грибной остров люти заполненный ландышами,false
904,0,65296b2760ee338bbd4bc8c4,Корзинка артов,База,false,1602,32329,Fortit,false,500,false,200,4040,19.09.2023,false,2023-10-13T16:07:03.539Z,2023-10-13T16:07:03.539Z,yellow,Личная база,false
903,0,6529697960ee338bbd4bc7fa,abs0lute,База,false,-2500,-4500,meety2k,false,500,false,-312,-562,07.10.2023,false,2023-10-13T15:59:53.436Z,2023-10-13T15:59:53.436Z,red,Место обитания братанчиков,false
902,0,6529690760ee338bbd4bc7b4,Мясистый пенис,База,false,25814,4203,Kart04ka,false,1500,false,3226,525,07.10.2023,false,2023-10-13T15:58:00.000Z,2023-12-12T12:39:05.969Z,green,Пепельница короля,false
901,0,6529689b60ee338bbd4bc778,Ферма редбулла,База,false,9243,-223,REDBULL_men,false,1000,false,1128,-27,07.10.2023,false,2023-10-13T15:56:11.520Z,2023-10-13T15:56:27.703Z,green,Моя база и ферма,false
900,0,6529682760ee338bbd4bc760,Терра Диагола,База,false,-500,29000,Dyagol,false,1000,false,-62,3500,06.10.2023,false,2023-10-13T15:54:15.319Z,2023-10-13T15:54:15.319Z,yellow,База для комфортного времени,false
899,0,652967b760ee338bbd4bc72d,Рисовые плантации,База,false,-11500,28000,t1mem1x,false,2000,false,-1437,3500,06.10.2023,false,2023-10-13T15:52:23.198Z,2023-12-17T00:55:48.235Z,yellow,<p>Рисовые плантации. Здесь выращивается чёрный рис для детей.</p>,true
898,0,6529674060ee338bbd4bc705,Ban04ka,База,false,-7500,28000,Banka3629,false,2000,false,-937,3500,06.10.2023,false,2023-10-13T15:50:24.049Z,2023-10-13T15:50:24.049Z,yellow,Територия  для чила,false
897,0,652966d960ee338bbd4bc6d7,Зона пониженной гравитации,База,false,-5504,188,The_M1lkyway,false,700,false,-685,22,06.10.2023,false,2023-10-13T15:48:41.532Z,2023-10-13T15:48:41.532Z,blue,Люто база сигмы,false
896,0,6529660760ee338bbd4bc684,КаваГрад,Город,false,-1024,-7307,blintvett,false,550,false,-125,-906,10.10.2023,false,2023-10-13T15:45:11.034Z,2023-10-13T15:45:11.034Z,red,Поселение внутри огромной пещеры. ,false
894,0,6529651360ee338bbd4bc5fe,Либревилл,Город,true,1503,15342,vladbrask,false,750,false,190,1910,08.10.2023,false,2023-10-13T15:41:07.957Z,2023-10-13T15:41:07.957Z,yellow,"Стремительно развивающийся город, объядинивший в себе людей, с абсолютно разными интересами, но одной целью. В переводе с ит. яз и франц. яз как ""Свободный город"" ",false
893,0,6529647060ee338bbd4bc5b9,Город злодеев,Город,false,-24954,1109,Prosto_NaIS,false,1000,false,-3123,130,07.10.2023,false,2023-10-13T15:38:24.533Z,2023-10-13T15:38:24.533Z,blue,"Город криминал, с интирест ной историей",false
892,0,6529640560ee338bbd4bc5ac,PiterGrad,Город,true,-6137,-1086,_miha_,false,450,false,-767,-134,06.10.2023,true,2023-10-13T15:36:37.313Z,2023-11-14T13:56:18.177Z,blue,Город выполненый в стиле Санкт-Петербурга.,false
891,0,6529636a60ee338bbd4bc592,Ромашковая долина,Город,false,309,-14052,newrochka,false,5.102023,false,35,-1752,05.10.2023,false,2023-10-13T15:34:02.653Z,2023-10-13T15:34:02.653Z,red,"Небольшой город, вдохновлённый Ромашковой долиной из смешариков. ",false
889,0,652961e460ee338bbd4bc54b,Заун,Город,true,5100,2157,_kewi_,false,1000,false,647,265,03.10.2023,false,2023-10-13T15:27:32.875Z,2023-10-13T15:27:32.875Z,green,Город крутых перцев,false
888,0,6529616860ee338bbd4bc537,PieceTown,Город,false,15179,1326,MrXyuz,false,500,false,1900,170,01.10.2023,false,2023-10-13T15:25:28.899Z,2023-10-13T15:25:28.899Z,green,Заросший город,false
887,0,6529605260ee338bbd4bc524,КСЕПОМСКАЯ ИМПЕРИЯ,Город,true,1419,11053,XEPOM,false,1000,false,172,1373,30.09.2023,false,2023-10-13T15:20:50.167Z,2023-11-19T18:10:13.259Z,yellow,ВЕЛИКАЯ ИМПЕРИЯ ИГРОКА КСЕПОМА,false
885,0,65295e2360ee338bbd4bc4ed,Стиль-Сити,Город,false,15108,-3327,Dobri_Evrei,false,1000,false,1888,-415,26.09.2023,false,2023-10-13T15:11:31.736Z,2023-10-13T15:11:31.736Z,green,город самых топовых людей с которыми  интересно общатся и икон стиля. Очень красивый  город со своей архитектурой,false
884,0,65295bec60ee338bbd4bc291,Территория OVERHAND_,База,false,-19500,-4500,OVERHAND_,false,1500,false,-2434,-583,18.11.2022,false,2023-10-13T15:02:04.795Z,2023-10-13T15:02:04.795Z,blue,Частная территория OVERHAND_,false
883,0,65295a4b60ee338bbd4bc22f,Альтенбург,Город,true,-4800,-1380,maxi_capybara,false,200,false,-610,-182,06.10.2023,false,2023-10-13T14:55:07.488Z,2023-11-24T16:23:12.998Z,blue,хайповый город,true
882,0,6529577060ee338bbd4bc18d,Кримисноу,Город,false,-2131,-10675,ivangou55,false,150,false,-262,-1335,13.10.2023,false,2023-10-13T14:42:56.417Z,2023-10-14T14:27:11.881Z,red,небогатый город бандитов,false
881,0,65292b2960ee338bbd4bbf05,База АртМании ,База,false,-32000,2600,NotQR_,false,2000,false,-4000,325,10.10.2023,false,2023-10-13T11:34:01.949Z,2023-10-13T13:58:23.694Z,blue," Закрытая база АртМании, можно войти через основную базу.",false
880,0,6529226660ee338bbd4bbd1c,zxcql0p1n4,База,false,-12000,-8500,legendaPVE,false,400,false,-1500,-1062,13.10.2023,false,2023-10-13T10:56:38.013Z,2023-10-13T10:56:38.013Z,blue,y4 tru ql0p,false
879,0,65285c8760ee338bbd4bb347,HEAVEN TO ME,База,false,601,-14287,burdik,false,120,false,69,-1783,12.10.2023,false,2023-10-12T20:52:23.415Z,2023-10-12T20:52:23.415Z,red,Территория Mr. Lonely,false
878,0,6528551b60ee338bbd4bb329,База Мишки,База,false,-15500,28000,_M1shk4_,false,2000,false,-1937,3500,12.10.2023,false,2023-10-12T20:20:43.726Z,2023-10-12T20:20:43.726Z,yellow,-,false
877,0,65194242ab687d4dd5d6dd44,Королевство Эдем,Город,false,6000,-2000,_kirl,false,2000,false,750,-250,04.06.2022,false,2023-10-01T09:56:18.518Z,2023-10-01T09:56:18.518Z,green,Город красоты и рыцарских дуэлей,false
876,0,650ef5b2cf063d67c09336c3,Problemsisity,База,false,-15639,-357,problemsis,false,1000,false,-1949,-10,19.09.2023,false,2023-09-23T14:26:58.019Z,2023-09-24T18:41:53.862Z,blue,культ личности,false
874,0,650ef5b1cf063d67c09336bb,Грибник Змея,База,false,-33900,-2950,Kzmey_,false,500,false,-4206,-341,18.09.2023,false,2023-09-23T14:26:57.853Z,2023-09-23T14:26:57.853Z,blue,чудный остров Змея,false
873,0,650ef5b1cf063d67c09336b7,База Кенеса,База,false,1680,14553,BaRMaLeI_,false,600,false,217,1825,18.09.2023,false,2023-09-23T14:26:57.769Z,2023-11-22T11:18:39.190Z,yellow,Владения Казахстана,false
872,0,650ef5b1cf063d67c09336b3,Базисная База,База,false,-17120,6120,Filagen,false,250,false,-2133,766,17.09.2023,false,2023-09-23T14:26:57.685Z,2023-09-23T14:26:57.685Z,blue,"хайп, для 
меня одного
",false
871,0,650ef5b1cf063d67c09336af,эм фто,База,false,586,19110,tuntsovaa,false,1300,false,72,2,17.09.2023,false,2023-09-23T14:26:57.601Z,2023-09-23T14:26:57.601Z,green,-,false
870,0,650ef5b1cf063d67c09336ab,пениснаябаза шайлушай э,База,false,8708,-11948,neikysohigh,false,50,false,1080,-1500,17.09.2023,false,2023-09-23T14:26:57.519Z,2023-09-23T14:26:57.519Z,red,-,false
868,0,650ef5b1cf063d67c09336a3,"Личная
тера
 MaxPlayYT_7406",База,false,-26688,-26813,MaxPlayYT_7406,false,600,false,-3333,-3360,14.09.2023,false,2023-09-23T14:26:57.352Z,2023-09-23T14:26:57.352Z,red,Тупо личная тера под фермы,false
867,0,650ef5b1cf063d67c093369f,Тера Саламандри,База,false,6801,-21235,MrSalamandra,false,2000,false,855,-2640,14.09.2023,false,2023-09-23T14:26:57.271Z,2023-09-23T14:26:57.271Z,red,-,false
866,0,650ef5b1cf063d67c093369b, база няшки,База,false,516,-14094, neftyanka,false,64,false,59,-1758,13.09.2023,false,2023-09-23T14:26:57.190Z,2023-09-23T14:26:57.190Z,red,моя добрая топовая база где будут очень няшные постройки зайки хотари,false
865,0,650ef5b1cf063d67c0933697,бобросити2,База,false,-16822,1463,cwhai,false,800,false,-2101,182,12.09.2023,false,2023-09-23T14:26:57.106Z,2023-09-23T14:26:57.106Z,blue,-,false
864,0,650ef5b1cf063d67c0933693,Монумент,База,false,-28414,-12751,chwai,false,200,false,-3556,-1594,11.09.2023,false,2023-09-23T14:26:57.024Z,2023-09-23T14:26:57.024Z,blue,"подводный 
монумент ферма",false
863,0,650ef5b0cf063d67c093368f,Биг Бен,База,false,-6646,-8286,Defaunter_,false,200,false,-823,-1035,10.09.2023,false,2023-09-23T14:26:56.942Z,2023-09-23T14:26:56.942Z,red,Большая база для ферм и ресов (куплена) ,false
862,0,650ef5b0cf063d67c093368b,База игрока Mazich,База,false,-750,-10311,Mazich,false,30,false,-93,-1288,10.09.2023,false,2023-09-23T14:26:56.862Z,2023-11-17T12:35:19.963Z,red,<p>База игрока Mazich</p>,true
861,0,650ef5b0cf063d67c0933687,ArtMatiz,База,false,-31700,5500,Salunee,false,1499,false,-4000,-700,10.09.2023,false,2023-09-23T14:26:56.779Z,2024-03-02T13:47:18.212Z,blue,Меза кайфовая,false
860,0,650ef5b0cf063d67c0933683,скибиди туалет против камера мена сигма 3,База,false,-31614,-12307,RANEWALL,false,300,false,-3951,-1538,10.09.2023,false,2023-09-23T14:26:56.695Z,2023-09-23T14:26:56.695Z,blue,База,false
859,0,650ef5b0cf063d67c093367f,"mystical     
base",База,false,-578,-21475,ZzzxlonWillt,false,350,false,-71,-2668,10.09.2023,false,2023-09-23T14:26:56.612Z,2023-11-22T18:55:32.418Z,red,база игрока,false
858,0,650ef5b0cf063d67c093367b,Военные склады,База,false,-1600,9040,SirTulpa,false,500,false,-205,1123,10.09.2023,false,2023-09-23T14:26:56.528Z,2024-05-15T16:31:23.981Z,yellow,База,true
857,0,650ef5b0cf063d67c0933677,PortalEnd,База,false,8708,-11948,neikysohigh,false,50,false,1080,-1500,09.09.2023,false,2023-09-23T14:26:56.446Z,2023-09-23T14:26:56.446Z,red,Портал в энд,false
856,0,650ef5b0cf063d67c0933673,ТипсТерра,База,false,-4048,-368,Tipsik420,false,100,false,-500,-30,08.09.2023,false,2023-09-23T14:26:56.365Z,2023-09-23T14:26:56.365Z,blue,"Невероятное место для фармма мешкофф, горшкофф, кишкофф.",false
854,0,650ef5b0cf063d67c093366b,База wa1ne,База,false,-7054,6628,wa1ne,false,100,false,-878,833,04.09.2023,false,2023-09-23T14:26:56.203Z,2023-10-13T16:36:59.275Z,yellow,Без описания,false
852,0,650ef5b0cf063d67c0933663,Кожурка,База,false,-28588,-1087,_HolanDiversity_,false,2000,false,-3572,-135,02.09.2023,false,2023-09-23T14:26:56.039Z,2023-09-23T14:26:56.039Z,blue,База отпетых мандаринов,false
851,0,650ef5afcf063d67c093365f,ПОНчик,База,false,-13025,-30177,_Guakamole_,false,2000,false,-1628,-3772,01.09.2023,false,2023-09-23T14:26:55.957Z,2023-09-23T14:26:55.957Z,red,Лютые пончики даб,false
850,0,650ef5afcf063d67c093365b,база sytosu,База,false,3578,-15535,sytosu,false,2000,false,446,-1944,01.09.2023,false,2023-09-23T14:26:55.873Z,2023-09-23T14:26:55.873Z,red,типа база,false
849,0,650ef5afcf063d67c0933657,Эщкерия,База,false,3300,13200,Endee4ka,false,2000,false,320,1480,31.08.2023,false,2023-09-23T14:26:55.788Z,2024-04-21T18:58:44.820Z,yellow,<p>-</p>,true
848,0,650ef5afcf063d67c0933653,Частный Комплекс Варден(ЧКВ),База,false,-13425,-28050,Mityakarpik,false,2000,false,-1678,-3506,29.08.2023,false,2023-09-23T14:26:55.706Z,2023-09-23T14:26:55.706Z,red,"Территория для хранения большого
кол-ва Варденов",false
847,0,650ef5afcf063d67c093364f,XYZ,База,false,-74,-20613,MARKALLICA,false,500,false,1,-2570,29.08.2023,false,2023-09-23T14:26:55.622Z,2023-09-23T14:26:55.622Z,red,база,false
846,0,650ef5afcf063d67c093364b,притончик риночки меф,База,false,-23616,10836,rina_mef,false,500,false,-2796,501,28.08.2023,false,2023-09-23T14:26:55.540Z,2023-09-23T14:26:55.540Z,blue,чилл флекс люти дрипчик,false
845,0,650ef5afcf063d67c0933647,АртМания ✨,База,false,-28000,2600,NotQR_,false,2000,false,-3500,325,27.08.2023,false,2023-09-23T14:26:55.460Z,2023-09-23T14:26:55.460Z,blue,Место для создания 3D артов и подобного.,false
844,0,650ef5afcf063d67c0933643,Территория RAMZES141 & Plelei,База,false,2520,1008,RAMZES141,false,500,false,313,113,26.08.2023,false,2023-09-23T14:26:55.379Z,2023-09-23T14:26:55.379Z,green,Чо ты бля,false
843,0,650ef5afcf063d67c093363f,Крым,База,false,3200,-27000,CbIH_MIYAGI,false,1000,false,400,-3375,25.08.2023,false,2023-09-23T14:26:55.299Z,2023-09-23T14:26:55.299Z,red,НАШ полуостров,false
842,0,650ef5afcf063d67c093363b,Урюпинск,База,false,-3160,-25200,Jerasa,false,1500,false,-790,-6300,25.08.2023,false,2023-09-23T14:26:55.219Z,2023-09-23T14:26:55.219Z,red,Вишняяяя деревьяяя,false
841,0,650ef5afcf063d67c0933637,ВеликийКитай,База,false,-25150,0,NuA4oTak,false,100,false,-3143,1,25.08.2023,false,2023-09-23T14:26:55.138Z,2023-09-23T14:26:55.138Z,blue,"Небольшой
островок с бамбуком 
и пандой под ним 
шахта и большая 
пещера с мхом",false
840,0,650ef5afcf063d67c0933633,База K1ner,База,false,-3000,-18000,K1ner,false,2000,false,-375,2250,25.08.2023,false,2023-09-23T14:26:55.050Z,2023-09-23T14:26:55.050Z,yellow,"Терриротия под базу,
фермы.",false
839,0,650ef5aecf063d67c093362f,грибной остров,База,false,-27000,6399,feboy4ik,false,200,false,-3375,799,25.08.2023,false,2023-09-23T14:26:54.967Z,2023-09-23T14:26:54.967Z,blue,грибной остров,false
838,0,650ef5aecf063d67c093362b,Усадьба Alter5,База,false,27000,350,Flafer_moy_kotik,false,750,false,3375,45,25.08.2023,false,2023-09-23T14:26:54.884Z,2023-12-14T11:55:04.372Z,green,"Крупное владение территории с большой усадьбой, и
всеми прилогающими-
-ся сооружениями.",false
837,0,650ef5aecf063d67c0933627,Гора Карамельки,База,false,-25520,18260,BrawlStars_,false,333,false,3200,2280,-,false,2023-09-23T14:26:54.800Z,2023-09-23T14:26:54.800Z,green,"Красивый холмик, с ратсущей сакурой. Рядом с ним
распологается аванпост разбойников.
",false
836,0,650ef5aecf063d67c0933623,База,База,false,25083,-21547,swetikkyt,false,550,false,3114,-2686,25.08.2023,false,2023-09-23T14:26:54.716Z,2023-09-23T14:26:54.716Z,green, Терра swetikkyt,false
835,0,650ef5aecf063d67c093361f," SandKing's
Territory",База,false,-26888,10348,Kujosi,false,2000,false,-3361,1923,25.08.2023,false,2023-09-23T14:26:54.632Z,2023-09-23T14:26:54.632Z,blue,-,false
834,0,650ef5aecf063d67c093361b,Уга Буга,База,false,131,26451,Shkolnik123,false,1500,false,26,3304,24.08.2023,false,2023-09-23T14:26:54.550Z,2023-09-23T14:26:54.550Z,yellow,База,false
833,0,650ef5aecf063d67c0933617,Бейз,База,false,26707,-22581,kyuko_,false,1000,false,3338,-2822,24.08.2023,false,2023-09-23T14:26:54.466Z,2024-05-12T07:05:59.270Z,green,Бейз,false
832,0,650ef5aecf063d67c0933613,Кухня,База,false,-17918,-15689,Kujosi,false,1000,false,-2239,-1961,24.08.2023,false,2023-09-23T14:26:54.386Z,2023-09-23T14:26:54.386Z,blue,"база игроков Kujosi,
Nehimin",false
831,0,650ef5aecf063d67c093360f, Mont croissant,База,false,-25767,9718,_Larens_ ,false,700,false,-3220,1214,24.08.2023,false,2023-09-23T14:26:54.302Z,2023-09-23T14:26:54.302Z,blue,жёсткая гора в виде croissan,false
830,0,650ef5aecf063d67c093360b,Бургерное Священное Регенство Перерождение ,База,false,-26600,-18750,sun_night_,false,1500,false,-3320,-2350,24.08.2023,false,2023-09-23T14:26:54.219Z,2023-09-23T14:26:54.219Z,blue,Жесткая база,false
829,0,650ef5aecf063d67c0933607,"Поместье
ТутиНути",База,false,-11000,-25900,Fititunati,false,1500,false,-1375,-3237,23.08.2023,false,2023-09-23T14:26:54.135Z,2023-09-23T14:26:54.135Z,red,"Дача игрока Фититунати, с прилугающей мезой и
джунглями",false
828,0,650ef5aecf063d67c0933603,мезза,База,false,-10230,-25332,wandering_yelow,false,1000,false,-1,-3166,23.08.2023,false,2023-09-23T14:26:54.052Z,2023-09-23T14:26:54.052Z,red,просто для ресов,false
827,0,650ef5adcf063d67c09335ff,Игристая меза,База,false,-9854,-25621,Fititunati,false,500,false,-1231,-3202,23.08.2023,false,2023-09-23T14:26:53.970Z,2023-09-23T14:26:53.970Z,red,"Меза на 
вершине крутых 
склонах треуголь-
ного острова
",false
826,0,650ef5adcf063d67c09335fb,МесаотТрарда,База,false,25038,21287,Gatvor,false,2000,false,3129,2660,23.08.2023,false,2023-09-23T14:26:53.886Z,2023-09-23T14:26:53.886Z,green,Полотна и меса для Трарда,false
825,0,650ef5adcf063d67c09335f7,Супер мега функциональная база Defaunter_,База,false,-1461,8927,Defaunter_,false,100,false,-182,1115,22.08.2023,false,2023-09-23T14:26:53.803Z,2023-09-23T14:26:53.803Z,yellow,не остров,false
824,0,650ef5adcf063d67c09335f3,База Сигм,База,false,-8950,6830,LifeSashechka29,false,1300,false,-1121,850,21.08.2023,false,2023-09-23T14:26:53.720Z,2023-10-27T12:42:00.528Z,blue,<3 <3 <3,false
823,0,650ef5adcf063d67c09335ef,Skorvod Land,База,false,-2293,5118,Skorvod,false,60,false,-284,629,21.08.2023,false,2023-09-23T14:26:53.637Z,2023-09-23T14:26:53.637Z,yellow,Личная база/дача игрока Skorvod,false
822,0,650ef5adcf063d67c09335eb,Территория SeryogaZOMbi,База,false,-12500,-14000,SeryogaZOMbi,false,1000,false,-1680,-1680,21.08.2023,false,2023-09-23T14:26:53.554Z,2023-09-23T14:26:53.554Z,red,Союз ТСКП,false
821,0,650ef5adcf063d67c09335e7,шахтер,База,false,3107,-8989,_Marsik_,false,500,false,398,-1125,21.08.2023,false,2023-09-23T14:26:53.471Z,2023-09-23T14:26:53.471Z,red,мини база на острове для ферм и житья,false
819,0,650ef5adcf063d67c09335df,База игроков JustTarum и LUPAStic,База,false,-3200,-10600,JustTarum,false,640,false,-400,-1325,21.08.2023,false,2023-09-23T14:26:53.307Z,2023-09-24T17:05:48.510Z,red,База,false
818,0,650ef5adcf063d67c09335db,База al1sher'a,База,false,2890,-6280,al1sher ,false,110,false,361,785,21.08.2023,false,2023-09-23T14:26:53.223Z,2023-09-23T14:26:53.223Z,yellow,место мечты,false
817,0,650ef5adcf063d67c09335d7,PoisonLand ,База,false,13843,434,Poison22cm,false,500,false,1730,57,20.08.2023,false,2023-09-23T14:26:53.140Z,2023-09-23T14:26:53.140Z,green,-,false
816,0,650ef5adcf063d67c09335d3,Sugomas,База,false,-4034,7823,Sugomas,false,500,false,-506,979,19.08.2023,false,2023-09-23T14:26:53.057Z,2023-09-23T14:26:53.057Z,yellow,База,false
815,0,650ef5accf063d67c09335cf,территория Fizalis`a,База,false,358,-17599,Fizalis,false,2000,false,48,-2208,18.08.2023,false,2023-09-23T14:26:52.974Z,2023-09-23T14:26:52.974Z,red,"Терра чтоб
жить и не тужть",false
814,0,650ef5accf063d67c09335cb,СКП,База,false,17493,17458,porosy338,false,2000,false,2187,2182,16.08.2023,false,2023-09-23T14:26:52.886Z,2023-09-23T14:26:52.886Z,green,-,false
813,0,650ef5accf063d67c09335c7,Лаба чар стола,База,false,0,10161,Danik4ek,false,50,false,1,1271,15.08.2023,false,2023-09-23T14:26:52.802Z,2023-09-23T14:26:52.802Z,yellow,Стол и книжные полки страдают фигней,false
812,0,650ef5accf063d67c09335c3,popa,База,false,-6774,7491,Milki25,false,250,false,-853,937,14.08.2023,false,2023-09-23T14:26:52.718Z,2023-09-23T14:26:52.718Z,yellow,popa,false
811,0,650ef5accf063d67c09335bf,База Шамиля,База,false,6257,-5023,Shanir,false,357,false,800,-620,11.08.2023,false,2023-09-23T14:26:52.634Z,2023-09-23T14:26:52.634Z,green,-,false
810,0,650ef5accf063d67c09335bb,Misanthrope,База,false,-918,-24122,Mr_Mlke_6,false,70,false,-127,-3004,10.08.2023,false,2023-09-23T14:26:52.551Z,2023-09-23T14:26:52.551Z,red,Горная местность с выходом в океан,false
809,0,650ef5accf063d67c09335b7,Пустоград,База,false,7480,-24967,Denatle,false,650,false,935,-3120,09.08.2023,false,2023-09-23T14:26:52.467Z,2023-09-23T14:26:52.467Z,red,Деревня неизвестного произхождения,false
808,0,650ef5accf063d67c09335b3,CbIH_MIYAGI и 1nsept_,База,false,-11500,13800,CbIH_MIYAGI,false,500,false,-1420,-1690,08.08.2023,false,2023-09-23T14:26:52.382Z,2023-09-23T14:26:52.382Z,red,-,false
807,0,650ef5accf063d67c09335af,Дрейнгород,База,false,-15777,6000,cantseeyou,false,450,false,-1978,747,07.08.2023,false,2023-09-23T14:26:52.298Z,2023-09-23T14:26:52.298Z,blue,-,false
806,0,650ef5accf063d67c09335ab,Дальний,База,false,-13900,-5900,_Datreydm_,false,750,false,-1737,737,07.08.2023,false,2023-09-23T14:26:52.215Z,2023-09-23T14:26:52.215Z,blue,Восток,false
